Discovered At,Feed Name,Feed Category,Title,URL,Published Date,Summary,Platform Relevance,Authority Score,Status
2026-03-07T17:49:30Z,Search Engine Journal,practitioner,"The 10 Best PPC Ad Networks via @sejournal, @LisaRocksSEM",https://www.searchenginejournal.com/ppc-guide/best-ppc-ad-networks/,2026-03-06,"This source argues for a data-driven approach to selecting paid media platforms for 2026, evaluating ten major ad networks. It measures key performance criteria including audience reach, the sophistication of targeting capabilities, and the level of automation available on each platform. The analysis implies that content creators and advertisers must prioritize platforms offering a combination of extensive scale, precise targeting, and automated optimization tools to effectively allocate budgets on future AI-powered search and advertising surfaces, where efficient, data-informed spending will be critical.",SEO; GEO; AI search,55.5,candidate
2026-03-07T17:46:37Z,Google Research Blog,official,Next generation medical image interpretation with MedGemma 1.5 and medical speech to text with MedASR,https://research.google/blog/next-generation-medical-image-interpretation-with-medgemma-15-and-medical-speech-to-text-with-medasr/,2026-01-13,"Generative AI refers to artificial intelligence systems capable of creating new content—like text, images, audio, and code—by learning patterns from vast datasets. These models, such as large language models (LLMs), generate outputs based on user prompts, powering applications from chatbots to creative tools. For content creators targeting AI-powered search, this implies a shift from traditional keyword SEO to optimizing for semantic understanding and authoritative sourcing, as these models synthesize information from diverse sources to provide direct, conversational answers. Success increasingly depends on producing clear, factual, and context-rich content that AI can reliably reference and summarize.",Google AI; search research,55.5,candidate
2026-03-07T17:46:21Z,Google Research Blog,official,"Small models, big results: Achieving superior intent extraction through decomposition",https://research.google/blog/small-models-big-results-achieving-superior-intent-extraction-through-decomposition/,2026-01-22,"Generative AI refers to artificial intelligence systems capable of creating new content—like text, images, audio, and code—by learning patterns from vast datasets. These models, such as large language models (LLMs), generate outputs based on user prompts, powering applications from chatbots to creative tools. For content creators targeting AI-powered search, this implies a shift from traditional keyword SEO to optimizing for semantic understanding and authoritative sourcing, as these models synthesize information from their training data to provide direct answers. Creators must focus on clarity, factual accuracy, and comprehensive coverage to be reliably cited as a source in AI-generated responses.",Google AI; search research,55.5,candidate
2026-03-07T17:46:11Z,Google Research Blog,official,ATLAS: Practical scaling laws for multilingual models,https://research.google/blog/atlas-practical-scaling-laws-for-multilingual-models/,2026-01-27,"Generative AI refers to artificial intelligence systems capable of creating new content—like text, images, audio, and code—by learning patterns from vast datasets. These models, such as large language models (LLMs), generate outputs based on user prompts, powering applications from chatbots to creative tools. For content creators targeting AI-powered search, this implies a shift from traditional keyword SEO to optimizing for semantic understanding and authoritative sourcing, as these models synthesize information from their training data to provide direct answers. Creators must focus on clarity, factual accuracy, and comprehensive coverage to be reliably cited as a source in AI-generated responses.",Google AI; search research,55.5,candidate
2026-03-07T17:46:05Z,Google Research Blog,official,Towards a science of scaling agent systems: When and why agent systems work,https://research.google/blog/towards-a-science-of-scaling-agent-systems-when-and-why-agent-systems-work/,2026-01-28,"Generative AI refers to artificial intelligence systems capable of creating new content—like text, images, audio, and code—by learning patterns from vast datasets. These models, such as large language models (LLMs), generate outputs based on user prompts, powering applications from chatbots to creative tools. For content creators targeting AI-powered search, this implies a shift from traditional keyword SEO to optimizing for semantic understanding and authoritative sourcing, as these models synthesize information from diverse sources to provide direct, conversational answers. Success increasingly depends on producing clear, factual, and context-rich content that AI can reliably reference and summarize.",Google AI; search research,55.5,candidate
2026-03-07T17:45:54Z,Google Research Blog,official,​Sequential Attention: Making AI models leaner and faster without sacrificing accuracy,https://research.google/blog/sequential-attention-making-ai-models-leaner-and-faster-without-sacrificing-accuracy/,2026-02-04,"This source argues that theoretical computer science, particularly algorithmic analysis and complexity theory, provides the essential mathematical foundation for modern AI systems. It finds that concepts like computational efficiency, optimization, and NP-completeness directly underpin the design and limitations of machine learning models and search algorithms. For content creators targeting AI-powered search, this implies that understanding these core algorithmic principles—how AI systems process, rank, and retrieve information under constraints—is crucial for developing strategies that align with the system's inherent logic and capabilities, moving beyond superficial keyword matching to address fundamental information processing behaviors.",Google AI; search research,55.5,candidate
2026-03-07T17:34:13Z,Semrush Blog,vendor_research,"How AI Tools Influence the Modern Buyer Journey: A Survey of 1,000+ US Consumers",https://www.semrush.com/blog/ai-tools-the-modern-buyer-journey-study/,2026-03-05,"<p><img alt=""How AI Tools Influence the Modern Buyer Journey: A Survey of 1,000+ US Consumers"" src=""https://static.semrush.com/blog/uploads/media/ff/f6/fff663584306a4496160f00677cfb256/8bcac269879a590e1fb4a08cc27eefcc/how-consumers-use-ai-to-research-and-buy-products-insights-from-1000-us-shoppers.svg"" width=""448"" /></p><p>AI is reshaping how people discover and buy products. Our survey of 1,000+ U.S. shoppers reveals how AI influences research, brand discovery, and purchases.</p>",GEO; AI Search; SEO,55.5,candidate
2026-03-08T04:59:34Z,Search Engine Journal,practitioner,"Google’s Liz Reid Says LLMs Unlock Audio And Video Indexing via @sejournal, @MattGSouthern",https://www.searchenginejournal.com/googles-liz-reid-says-llms-unlock-audio-and-video-indexing/569009/,2026-03-07,"Google's head of Search, Liz Reid, argued that multimodal large language models (LLMs) enable the indexing and understanding of audio and video content, which was previously difficult. This advancement allows Google Search to process and retrieve information from non-text media. The discussion also indicated a potential future for ""subscription-aware"" search, where results could account for a user's paid content subscriptions. For creators, this implies that optimizing audio and video content for AI comprehension is becoming critical for visibility in AI-powered search, and they may need to consider how paywalled or subscription-based content integrates with these evolving search systems.",SEO; GEO; AI search,53.5,candidate
2026-03-07T17:50:30Z,Search Engine Journal,practitioner,"Google Updates AI Recipe Results To Send More Traffic via @sejournal, @martinibuster",https://www.searchenginejournal.com/google-updates-ai-mode-recipe-sites-results/568798/,2026-03-04,"Google updated its AI Overviews for recipe searches to display more detailed recipe information directly, including ingredients and steps, while also prominently featuring source links. This change was measured to increase click-through rates to the original recipe websites. The update argues that Google is refining its AI-powered search to balance providing immediate answers with driving meaningful traffic to content creators. For creators targeting AI search surfaces, this implies that well-structured, authoritative content with clear factual data remains valuable, as Google's AI systems are being tuned to both answer queries and attribute traffic to sources.",SEO; GEO; AI search,53.5,candidate
2026-03-07T17:50:04Z,Search Engine Journal,practitioner,"The Verified Source Pack Agents Trust First via @sejournal, @DuaneForrester",https://www.searchenginejournal.com/the-verified-source-pack-agents-trust-first/568506/,2026-03-05,"The article argues that technical SEO is shifting from basic crawl optimization to ""truth packaging,"" establishing verified source packs as a new infrastructure layer for AI agents. It details how these structured data packages, containing verified facts and citations, are prioritized by AI search systems to assess content credibility. This implies content creators must move beyond traditional SEO to implement structured, authoritative data verification, ensuring their information is packaged as a trusted source for AI-driven search and answer generation.",SEO; GEO; AI search,53.5,candidate
2026-03-07T17:34:13Z,Semrush Blog,vendor_research,How to Track Your Google AI Mode Visibility with Semrush,https://www.semrush.com/blog/track-google-ai-mode-visibility-with-semrush/,2026-03-09,"<p><img alt=""How to Track Your Google AI Mode Visibility with Semrush"" src=""https://static.semrush.com/blog/uploads/media/a2/bf/a2bf650e161364ba675a454d6cff6b20/828bd9e33017e73ddaced37352cef7b0/how-to-track-your-google-ai-mode-visibility-with-semrush.svg"" width=""448"" /></p><p>Learn how to track your Google AI Mode visibility using Semrush. Analyze competitors, track rankings, and grow your presence in AI search.</p>",GEO; AI Search; SEO,53.5,candidate
2026-03-09T05:14:38Z,arXiv cs.IR recent,research,RED: Robust Event-Guided Motion Deblurring with Modality-Specific Disentanglement,https://arxiv.org/abs/2509.05554,2026-03-09,"This research addresses performance degradation in event-guided motion deblurring when event cameras under-report motion data due to thresholding. The authors argue that existing methods fail because they assume dense, stable event streams and use fusion techniques that allow disrupted events to corrupt the image reconstruction process. To improve robustness, they introduce a Robustness-Oriented Perturbation Strategy (RPS) that simulates various sensor thresholds during training, exposing the model to diverse under-reporting patterns. This implies that for AI systems relying on multi-modal or sensor fusion, training must explicitly account for and simulate real-world data imperfections and disruptions to prevent contamination of core representations and maintain performance.",IR; Retrieval; GEO,52.5,candidate
2026-03-09T05:14:04Z,arXiv cs.IR recent,research,The DSA's Blind Spot: Algorithmic Audit of Advertising and Minor Profiling on TikTok,https://arxiv.org/abs/2603.05653,2026-03-09,"This study conducted an algorithmic audit of TikTok using sock-puppet accounts simulating minor and adult users to measure the prevalence of commercial content. It found that while direct ads are restricted for minors, functionally equivalent promotional content, like influencer marketing, is not covered by the DSA's Article 28(2) prohibition on profiling-based advertising to minors. This reveals a significant regulatory gap. For content creators targeting AI-powered search and recommendation surfaces, the findings imply that promotional strategies blending into organic content, rather than formal advertisements, can effectively reach and influence vulnerable adolescent audiences despite existing regulations.",IR; Retrieval; GEO,52.5,candidate
2026-03-09T05:13:30Z,arXiv cs.IR recent,research,ChatShopBuddy: Towards Reliable Conversational Shopping Agents via Reinforcement Learning,https://arxiv.org/abs/2603.06065,2026-03-09,"This research developed SmartShopBench, a benchmark for evaluating conversational shopping agents, and a multi-objective reinforcement learning (RL) method to optimize them. The study measured performance across interdependent goals: objective product correctness, subjective persuasiveness, final response quality, and tool-use efficiency. The RL approach was found to effectively balance these competing objectives, improving overall agent performance. For content creators targeting AI search, this implies that AI agents are being systematically trained to not only retrieve correct information but also to synthesize it persuasively and efficiently. Success in AI-powered search will therefore depend on content that is accurate, contextually rich, and structured to support these multi-faceted agent goals.",IR; Retrieval; GEO,50.5,candidate
2026-03-09T05:18:59Z,arXiv cs.AI recent,research,Exploring Human-in-the-Loop Themes in AI Application Development: An Empirical Thematic Analysis,https://arxiv.org/abs/2603.05510,2026-03-09,"This study analyzed challenges in deploying AI systems where human oversight is unclear, combining a chatbot diary study and expert interviews. It found that while Human-in-the-Loop (HITL) principles are recognized, practical guidance for roles and feedback is fragmented. Key themes identified were the need for clear AI governance and human authority, iterative HITL refinement processes, and managing the full AI lifecycle within operational constraints. For content creators targeting AI search, this implies that systems increasingly incorporate structured human oversight and iterative feedback loops. Content must therefore be designed not just for algorithmic retrieval but to support and integrate into these human-AI collaborative workflows, aligning with governance frameworks and lifecycle checkpoints to remain effective and trustworthy.",AI systems; agents; reasoning,50.0,candidate
2026-03-09T05:18:19Z,arXiv cs.AI recent,research,Artificial Intelligence for Climate Adaptation: Reinforcement Learning for Climate Change-Resilient Transport,https://arxiv.org/abs/2603.06278,2026-03-09,"This research proposes a reinforcement learning (RL) framework to optimize long-term urban flood adaptation planning under climate uncertainty. It integrates rainfall projections, flood modeling, and transport simulations into a decision-support model to quantify direct infrastructure and indirect mobility impacts. The framework is designed to address the sequential nature of infrastructure investment and complex system interactions. For content creators targeting AI search, this implies that comprehensive, multi-model analyses addressing complex, long-term planning challenges are valuable for AI systems tasked with synthesizing technical research for decision-support applications.",AI systems; agents; reasoning,50.0,candidate
2026-03-09T05:18:14Z,arXiv cs.AI recent,research,Conversational Demand Response: Bidirectional Aggregator-Prosumer Coordination through Agentic AI,https://arxiv.org/abs/2603.06217,2026-03-09,"This paper introduces Conversational Demand Response (CDR), a coordination mechanism where energy aggregators and prosumers interact via bidirectional natural language, enabled by agentic AI. It argues that existing automated or one-way systems limit informed decision-making. The developed multi-agent architecture allows an aggregator agent to dispatch flexibility requests, while a prosumer's Home Energy Management System (HEMS) assesses deliverability and cost-benefit using an optimization tool. This also enables prosumer-initiated upstream communication. For content creators targeting AI search, it implies that systems are evolving to handle complex, multi-turn natural language negotiations between specialized agents, moving beyond simple retrieval to interactive, tool-calling dialogues for decision support.",AI systems; agents; reasoning,50.0,candidate
2026-03-09T05:18:00Z,arXiv cs.AI recent,research,Aggregative Semantics for Quantitative Bipolar Argumentation Frameworks,https://arxiv.org/abs/2603.06067,2026-03-09,"This paper introduces a new family of ""aggregative semantics"" for Quantitative Bipolar Argumentation Frameworks (QBAFs), which model arguments with intrinsic weights and attack/support relations. It argues that attackers and supporters should be aggregated separately, rather than symmetrically, to better handle their asymmetric roles. This finding implies that for AI search and content creators, structuring information with clear, weighted, and logically separated supportive and opposing arguments could improve how AI systems interpret and rank that content's credibility within AI-powered search and reasoning surfaces.",AI systems; agents; reasoning,50.0,candidate
2026-03-09T05:17:17Z,arXiv cs.AI recent,research,Real-Time AI Service Economy: A Framework for Agentic Computing Across the Continuum,https://arxiv.org/abs/2603.05614,2026-03-09,"This research argues that the structure of service-dependency graphs (modeled as DAGs) is crucial for the reliability of decentralized, price-based resource allocation in AI systems across the device-edge-cloud continuum. It finds that when these dependency graphs are hierarchical (tree or series-parallel structures), price mechanisms converge to stable equilibria and optimal resource allocations can be computed efficiently. For content creators targeting AI-powered search, this implies that the underlying architecture and dependency chains of the AI services delivering their content significantly influence system performance and resource competition. Ensuring content can be processed within efficient, hierarchical pipelines may improve its reliable and timely delivery through these complex, decentralized systems.",AI systems; agents; reasoning,50.0,candidate
2026-03-09T05:17:10Z,arXiv cs.AI recent,research,RoboLayout: Differentiable 3D Scene Generation for Embodied Agents,https://arxiv.org/abs/2603.05522,2026-03-09,"This paper introduces RoboLayout, an extension of LayoutVLM, which argues that generating physically feasible 3D scene layouts for embodied agents requires explicit agent-aware reasoning. It measures the integration of reachability constraints into a differentiable optimization process. The system was found to generate layouts that are more navigable and actionable for agents, improving upon prior methods focused only on semantic coherence. For content creators targeting AI search, this implies that optimizing for AI agents—such as by structuring information to account for physical constraints and interactive feasibility—will become increasingly critical as these models power more practical, action-oriented search and task completion systems.",AI systems; agents; reasoning,50.0,candidate
2026-03-09T05:15:58Z,arXiv cs.CL recent,research,CodeScout: Contextual Problem Statement Enhancement for Software Agents,https://arxiv.org/abs/2603.05744,2026-03-09,"This study analyzed AI code assistance tools and found they often fail on poorly-defined tasks, leading to inefficient, repetitive attempts and suboptimal results. It argues that these failures correlate with long, unproductive agent trajectories. The paper introduces CodeScout, a contextual query refinement method that addresses this by using lightweight pre-exploration of a codebase to systematically convert vague user requests into comprehensive, actionable problem statements. For content creators targeting AI search, this implies that success depends on proactively providing rich, structured context and specifications within content, as AI systems perform poorly with underspecified queries and require well-defined inputs to generate optimal outcomes.",LLMs; language retrieval,50.0,candidate
2026-03-09T05:15:51Z,arXiv cs.CL recent,research,"Let's Talk, Not Type: An Oral-First Multi-Agent Architecture for Guaran\'i",https://arxiv.org/abs/2603.05743,2026-03-09,"This position paper argues that standard text-first AI/HCI design inadequately serves primarily oral languages like Guaraní. It proposes an alternative oral-first, multi-agent architecture that decouples natural language understanding from conversation management and community-led governance. The framework demonstrates that effective language support must align with lived oral practices, not just written forms. For content creators, this implies that optimizing for AI search requires moving beyond text-centric models and considering oral modalities and community governance, especially for indigenous and oral languages, to ensure genuine accessibility and representation.",LLMs; language retrieval,50.0,candidate
2026-03-07T17:52:04Z,Benedict Evans,analyst,AI metrics,https://www.ben-evans.com/benedictevans/2025/6/9/generative-ais-metrics-question,2025-06-09,"This source argues that measuring growth during platform shifts, like the rise of AI search, is fundamentally challenging due to unclear data, definitions, and the uncertain future role of the new platform itself. For content creators, this implies that traditional metrics may be obsolete. Success will depend on anticipating and optimizing for the undefined final form of AI-powered search surfaces, rather than relying on established measurement frameworks.",AI industry; tech strategy,50.0,candidate
2026-03-07T17:34:12Z,OpenAI News,official,GPT-5.4 Thinking System Card,https://openai.com/index/gpt-5-4-thinking-system-card,2026-03-05,,ChatGPT Search; GPT ecosystem,50.0,candidate
2026-03-07T17:34:12Z,OpenAI News,official,"Reasoning models struggle to control their chains of thought, and that’s good",https://openai.com/index/reasoning-models-chain-of-thought-controllability,2026-03-05,"OpenAI introduces CoT-Control and finds reasoning models struggle to control their chains of thought, reinforcing monitorability as an AI safety safeguard.",ChatGPT Search; GPT ecosystem,50.0,candidate
2026-03-07T17:34:12Z,OpenAI News,official,Ensuring AI use in education leads to opportunity,https://openai.com/index/ai-education-opportunity,2026-03-05,"OpenAI shares new tools, certifications, and measurement resources to help schools and universities close AI capability gaps and expand opportunity.",ChatGPT Search; GPT ecosystem,50.0,candidate
2026-03-07T17:34:12Z,OpenAI News,official,The five AI value models driving business reinvention,https://openai.com/index/the-five-ai-value-models-driving-business-reinvention,2026-03-05,Five AI value models show how leaders can sequence AI from workforce fluency to process reinvention and build durable business advantage.,ChatGPT Search; GPT ecosystem,50.0,candidate
2026-03-07T17:34:12Z,OpenAI News,official,Introducing the Adoption news channel,https://openai.com/index/introducing-the-adoption-news-channel,2026-03-05,Practical insights and frameworks to turn AI progress into business advantage,ChatGPT Search; GPT ecosystem,50.0,candidate
2026-03-07T17:34:12Z,OpenAI News,official,Extending single-minus amplitudes to gravitons,https://openai.com/index/extending-single-minus-amplitudes-to-gravitons,2026-03-04,"A new preprint extends single-minus amplitudes to gravitons, with GPT-5.2 Pro helping derive and verify nonzero graviton tree amplitudes in quantum gravity.",ChatGPT Search; GPT ecosystem,50.0,candidate
2026-03-07T17:34:12Z,OpenAI News,official,How Axios uses AI to help deliver high-impact local journalism,https://openai.com/index/axios-allison-murphy,2026-03-04,"Axios COO Allison Murphy explains how the company uses AI to support local reporters, streamline newsroom workflows, and deliver high-impact local journalism at scale.",ChatGPT Search; GPT ecosystem,50.0,candidate
2026-03-07T17:34:12Z,OpenAI News,official,Understanding AI and learning outcomes,https://openai.com/index/understanding-ai-and-learning-outcomes,2026-03-04,OpenAI introduces the Learning Outcomes Measurement Suite to assess AI’s impact on student learning across diverse educational environments over time.,ChatGPT Search; GPT ecosystem,50.0,candidate
2026-03-07T17:34:12Z,OpenAI News,official,GPT-5.3 Instant System Card,https://openai.com/index/gpt-5-3-instant-system-card,2026-03-03,,ChatGPT Search; GPT ecosystem,50.0,candidate
2026-03-07T17:34:12Z,OpenAI News,official,"GPT-5.3 Instant: Smoother, more useful everyday conversations",https://openai.com/index/gpt-5-3-instant,2026-03-03,,ChatGPT Search; GPT ecosystem,50.0,candidate
2026-03-07T17:34:12Z,OpenAI News,official,Our agreement with the Department of War,https://openai.com/index/our-agreement-with-the-department-of-war,2026-02-28,"Details on OpenAI’s contract with the Department of War, outlining safety red lines, legal protections, and how AI systems will be deployed in classified environments.",ChatGPT Search; GPT ecosystem,50.0,candidate
2026-03-07T17:34:12Z,OpenAI News,official,Introducing the Stateful Runtime Environment for Agents in Amazon Bedrock,https://openai.com/index/introducing-the-stateful-runtime-environment-for-agents-in-amazon-bedrock,2026-02-27,"Stateful Runtime for Agents in Amazon Bedrock brings persistent orchestration, memory, and secure execution to multi-step AI workflows powered by OpenAI.",ChatGPT Search; GPT ecosystem,50.0,candidate
2026-03-07T17:34:12Z,OpenAI News,official,Scaling AI for everyone,https://openai.com/index/scaling-ai-for-everyone,2026-02-27,"Today we’re announcing $110B in new investment at a $730B pre money valuation. This includes $30B from SoftBank, $30B from NVIDIA, and $50B from Amazon.",ChatGPT Search; GPT ecosystem,50.0,candidate
