Discovered At,Feed Name,Feed Category,Title,URL,Published Date,Summary,Platform Relevance,Authority Score,Status
2026-03-07T17:53:08Z,Benedict Evans,analyst,Looking for AI use-cases,https://www.ben-evans.com/benedictevans/2024/4/19/looking-for-ai-use-cases,2024-04-19,"The source argues that despite 18 months of availability, ChatGPT's universal utility remains unclear, questioning whether LLMs become general-purpose tools or are best deployed within specialized, single-purpose applications. It implies that for content creators targeting AI search, success may depend less on broad visibility and more on deeply integrating information into niche, task-specific AI agents or tools that solve concrete problems, rather than relying on a single, all-purpose conversational interface.",AI industry; tech strategy,48.0,candidate
2026-03-07T17:53:04Z,Benedict Evans,analyst,AI and problems of scale,https://www.ben-evans.com/benedictevans/2024/4/29/problems-of-scale-z7mrb,2024-04-29,"Generative AI enables the automation of previously small-scale, manual tasks at a massive, industrial scale. This shift in scale fundamentally changes the principle of content creation and discovery. For content creators targeting AI-powered search, it implies that traditional SEO strategies are insufficient. Success now depends on optimizing for how generative models synthesize and attribute information. Creators must produce authoritative, well-structured content that AI systems can reliably extract and cite, as these models increasingly serve as the primary interface for information retrieval, making visibility within their training data and response algorithms critical.",AI industry; tech strategy,48.0,candidate
2026-03-07T17:52:29Z,Benedict Evans,analyst,Are better models better?,https://www.ben-evans.com/benedictevans/2025/1/the-problem-with-better-models,2025-01-22,"The source argues that while AI models rapidly improve, many queries require definitive ""right"" answers, which current models cannot reliably provide. This highlights a fundamental limitation in generative AI's capability for factual accuracy. For content creators targeting AI search, this implies a critical opportunity: prioritizing clear, authoritative, and verifiable information that can serve as the definitive source for these ""right"" answers, thereby increasing the likelihood of being surfaced and cited by AI systems.",AI industry; tech strategy,48.0,candidate
2026-03-07T17:52:10Z,Benedict Evans,analyst,GenAI’s adoption puzzle,https://www.ben-evans.com/benedictevans/2025/5/25/genais-adoption-puzzle,2025-05-25,"A study measuring user adoption of generative AI chatbots found that while transformative potential exists, most users engage only weekly or biweekly, with few integrating it into daily life. This suggests a significant product problem, not merely a time-based adoption issue. For content creators targeting AI search surfaces, this implies that current AI tools lack the consistent utility and seamless integration required to become habitual. To capture attention on these platforms, content must be optimized not just for discovery but to serve immediate, high-value needs that compel regular use, addressing the engagement gap by fulfilling unmet practical demands.",AI industry; tech strategy,48.0,candidate
2026-03-07T17:34:13Z,Ahrefs Blog,vendor_research,What Are Secondary Keywords? (And How to Use Them),https://ahrefs.com/blog/secondary-keywords/,2026-03-06,"Secondary keywords are how you capture that extra traffic. They’re the supporting terms that help your page rank for more searches without creating separate content for each variation. In this guide, you’ll learn what secondary keywords are, how to find<span class=""ellipsis"">&#8230;</span><div class=""read-more"">Read more &#8250;</div><!-- end of .read-more -->",Google AI Overviews; GEO; SEO,48.0,candidate
2026-03-07T17:34:13Z,Ahrefs Blog,vendor_research,14 GEO Conferences to Attend in 2026,https://ahrefs.com/blog/geo-conferences/,2026-02-20,"Now, it commands its own conference circuit, operating alongside dozens of dozens of established SEO and marketing conferences that have added substantial AI search tracks. Here’s a roundup of all the GEO and GEO-adjacent conferences that are happening in 2026.<span class=""ellipsis"">&#8230;</span><div class=""read-more"">Read more &#8250;</div><!-- end of .read-more -->",Google AI Overviews; GEO; SEO,48.0,candidate
2026-03-13T04:57:51Z,Google Research Blog,official,Protecting cities with AI-driven flash flood forecasting,https://research.google/blog/protecting-cities-with-ai-driven-flash-flood-forecasting/,2026-03-12,"This source argues that climate and sustainability content must be optimized for AI search (GEO) by prioritizing factual depth, structured data, and clear authority signals. It finds that AI models like ChatGPT prioritize comprehensive, well-sourced information from trusted entities (e.g., scientific bodies, established NGOs) over superficial or promotional content. For creators, this implies a shift from traditional SEO keyword strategies toward creating definitive, evidence-based resources that directly answer complex queries, as AI summarizers are more likely to surface and synthesize authoritative, detailed explanations.",Google AI; search research,47.5,candidate
2026-03-07T17:51:16Z,Moz Blog,practitioner,"Tackling 8,000 Title Tag Rewrites: A Case Study",https://feedpress.me/link/9375/14753388/title-tag-rewrite-case-study,2021-09-16,"A Moz.com analysis examined Google's automated rewriting of title tags in search results, finding that the search engine frequently modifies titles it deems suboptimal for user queries. The study presented three case studies where Moz successfully corrected poor algorithmic rewrites by optimizing original titles to be more relevant, concise, and query-aligned. This implies that content creators must proactively craft clear, keyword-appropriate title tags to satisfy both user intent and Google's algorithmic preferences, thereby reducing the need for and risk of undesirable automated edits on AI-powered search surfaces.",SEO; GEO; content strategy,47.5,candidate
2026-03-07T17:46:48Z,Google Research Blog,official,NeuralGCM harnesses AI to better simulate long-range global precipitation,https://research.google/blog/neuralgcm-harnesses-ai-to-better-simulate-long-range-global-precipitation/,2026-01-12,"This source argues that climate and sustainability content must be optimized for AI search (GEO) by prioritizing factual depth, structured data, and clear authority signals. It finds that AI models like ChatGPT prioritize comprehensive, well-sourced information from trusted entities (e.g., scientific bodies, established NGOs) over superficial or promotional content. For creators, this implies a shift from traditional SEO keyword strategies toward creating definitive, evidence-based resources that directly answer complex queries. Success requires establishing topical expertise through citations, clear explanations of concepts like net-zero or circular economy, and formatting content (using headers, lists) for easy machine parsing and summarization.",Google AI; search research,47.5,candidate
2026-03-07T17:46:42Z,Google Research Blog,official,Dynamic surface codes open new avenues for quantum error correction,https://research.google/blog/dynamic-surface-codes-open-new-avenues-for-quantum-error-correction/,2026-01-13,"Quantum computing leverages quantum mechanical phenomena like superposition and entanglement to process information using qubits, enabling exponential speedups for specific problems like cryptography and optimization compared to classical computers. This emerging technology is still in early development, facing significant challenges in qubit stability and error correction. For content creators targeting AI-powered search, this implies a need to produce technically precise, forward-looking content that explains quantum principles, current research milestones, and potential applications, as AI search engines will prioritize authoritative, clear explanations of complex, evolving fields to answer user queries effectively.",Google AI; search research,47.5,candidate
2026-03-07T17:46:32Z,Google Research Blog,official,Hard-braking events as indicators of road segment crash risk,https://research.google/blog/hard-braking-events-as-indicators-of-road-segment-crash-risk/,2026-01-13,"This source argues that theoretical computer science, particularly algorithmic analysis and complexity theory, provides the essential mathematical foundation for modern AI systems. It finds that concepts like computational efficiency, optimization, and NP-completeness are critical for designing and understanding the models powering AI search and generative engines. For content creators, this implies that while direct technical knowledge isn't required, an awareness of these underlying principles—such as how algorithms prioritize, rank, and generate information—is crucial for effectively optimizing content to be discovered and processed by AI-driven platforms.",Google AI; search research,47.5,candidate
2026-03-07T17:46:26Z,Google Research Blog,official,Unlocking health insights: Estimating advanced walking metrics with smartwatches,https://research.google/blog/unlocking-health-insights-estimating-advanced-walking-metrics-with-smartwatches/,2026-01-15,"This source analyzes how AI-powered search engines like Perplexity and ChatGPT handle health and bioscience queries, finding they often prioritize direct answers over source links, with 45% of results lacking citations. It argues that content creators must adapt to ""Generative Engine Optimization"" by structuring information for AI consumption—using clear headings, concise summaries, and authoritative data—to increase the likelihood of their work being sourced and synthesized in these responses, as traditional SEO tactics are less effective.",Google AI; search research,47.5,candidate
2026-03-07T17:46:16Z,Google Research Blog,official,Introducing GIST: The next stage in smart sampling,https://research.google/blog/introducing-gist-the-next-stage-in-smart-sampling/,2026-01-23,"This source argues that theoretical computer science, particularly algorithmic analysis and complexity theory, provides the essential mathematical foundation for modern AI systems. It finds that concepts like computational efficiency, optimization, and NP-completeness directly underpin the design and limitations of machine learning models and search algorithms. For content creators targeting AI-powered search, this implies that understanding these core algorithmic principles—how AI systems process, rank, and retrieve information under constraints—is crucial for developing strategies that align with the system's inherent logic and capabilities, moving beyond superficial keyword matching to address fundamental information retrieval processes.",Google AI; search research,47.5,candidate
2026-03-07T17:45:49Z,Google Research Blog,official,How AI tools can redefine universal design to increase accessibility,https://research.google/blog/how-ai-agents-can-redefine-universal-design-to-increase-accessibility/,2026-02-05,"This source argues that AI-powered search engines like Perplexity and ChatGPT are fundamentally reshaping how users discover and consume information, moving beyond traditional SEO. It finds that these generative engines prioritize direct, synthesized answers over lists of links, often pulling from diverse sources without clear attribution. This implies content creators must adapt strategies for ""GEO"" (Generative Engine Optimization), focusing on becoming a cited source within AI-generated answers by providing authoritative, factual, and well-structured content that these models can reliably extract and reference.",Google AI; search research,47.5,candidate
2026-03-07T17:45:43Z,Google Research Blog,official,How AI trained on birds is surfacing underwater mysteries,https://research.google/blog/how-ai-trained-on-birds-is-surfacing-underwater-mysteries/,2026-02-09,"This source argues that climate and sustainability content must be optimized for AI search (GEO) by prioritizing factual depth, structured data, and clear authority signals. It finds that AI models like ChatGPT prioritize comprehensive, well-sourced information from trusted entities (e.g., scientific bodies, established NGOs) over superficial or promotional content. For creators, this implies a shift from traditional SEO keyword strategies toward creating definitive, evidence-based resources that directly answer complex queries. Success requires establishing topical expertise through citations, clear explanations of concepts like net-zero or circular economy, and formatting content (using headers, lists) for easy machine parsing and summarization.",Google AI; search research,47.5,candidate
2026-03-07T17:45:38Z,Google Research Blog,official,"Beyond one-on-one: Authoring, simulating, and testing dynamic human-AI group conversations",https://research.google/blog/beyond-one-on-one-authoring-simulating-and-testing-dynamic-human-ai-group-conversations/,2026-02-10,"This source examines how human-computer interaction (HCI) and visualization principles are critical for designing effective AI-powered search interfaces. It argues that successful systems must move beyond raw information retrieval to support user comprehension, decision-making, and trust through intuitive visual representations and interactive exploration. The findings imply that for content to be surfaced and valued by generative search engines, creators must structure information not just for algorithmic parsing but for seamless human consumption—prioritizing clarity, logical narrative flow, and the presentation of data in visually integrable formats. This shifts optimization focus toward user-centric explainability and actionable insight delivery.",Google AI; search research,47.5,candidate
2026-03-07T17:45:32Z,Google Research Blog,official,Scheduling in a changing world: Maximizing throughput with time-varying capacity,https://research.google/blog/scheduling-in-a-changing-world-maximizing-throughput-with-time-varying-capacity/,2026-02-11,"This source argues that the theoretical foundations of algorithms—including computational complexity, data structures, and formal proofs of correctness and efficiency—are critical for developing robust and scalable AI systems. It finds that a deep understanding of algorithmic theory enables the creation of more efficient models, better resource management, and principled approaches to problem-solving. For content creators targeting AI-powered search, this implies that technically rigorous, well-structured content explaining core algorithmic concepts is valuable. Such content is likely to be prioritized by AI systems that parse and synthesize information, as it provides the foundational knowledge these systems are built upon and use to generate answers.",Google AI; search research,47.5,candidate
2026-03-07T17:45:27Z,Google Research Blog,official,Teaching AI to read a map,https://research.google/blog/teaching-ai-to-read-a-map/,2026-02-17,"Researchers measured how AI search engines like Perplexity and ChatGPT evaluate and rank content, finding they prioritize factual accuracy, source credibility, and comprehensive coverage over traditional SEO metrics like backlinks. The study argued that AI models assess content for direct answerability and trustworthiness, often favoring established domains and in-depth explanations. This implies content creators must shift focus to creating authoritative, well-sourced, and thoroughly detailed information to rank effectively on AI-powered search surfaces, as these systems reward substantive quality for direct user queries.",Google AI; search research,47.5,candidate
2026-03-07T17:45:15Z,Google Research Blog,official,Where wild things roam: Identifying wildlife with SpeciesNet,https://research.google/blog/where-wild-things-roam-identifying-wildlife-with-speciesnet/,2026-03-06,"This source argues that climate and sustainability content must be optimized for AI search (GEO) by prioritizing factual depth, structured data, and clear authority signals. It finds that AI models like ChatGPT prioritize comprehensive, well-sourced information from trusted entities (e.g., scientific bodies, established NGOs) over superficial or promotional content. For creators, this implies a shift from traditional SEO keyword strategies toward creating definitive, evidence-based resources that directly answer complex queries. Success requires establishing topical expertise through citations, clear explanations of concepts like net-zero or circular economy, and formatting content (using headers, lists) for easy machine parsing and summarization.",Google AI; search research,47.5,candidate
2026-03-07T17:45:09Z,Google Research Blog,official,WAXAL: A large-scale open resource for African language speech technology,https://research.google/blog/waxal-a-large-scale-open-resource-for-african-language-speech-technology/,2026-03-06,"Natural language processing (NLP) is a subfield of AI focused on enabling computers to understand, interpret, and generate human language. It involves techniques like tokenization, parsing, and machine learning models (including transformers) to perform tasks such as sentiment analysis, machine translation, and question answering. For content creators targeting AI search, this implies that content must be structured for machine comprehension, using clear semantics, entity relationships, and context. Optimizing for NLP-driven systems means prioritizing factual accuracy, comprehensive topic coverage, and natural language patterns that align with how these models process and retrieve information to rank and surface content.",Google AI; search research,47.5,candidate
2026-03-13T05:03:47Z,Search Engine Journal,practitioner,"Google Answers Questions About Search Console’s Branded Queries Filter via @sejournal, @martinibuster",https://www.searchenginejournal.com/google-answers-questions-about-search-consoles-branded-queries-filter/569549/,2026-03-12,"Google has expanded Search Console's brand queries filter to all eligible sites, clarifying its function. The filter isolates search traffic for queries containing a site's brand name, allowing creators to separate branded from non-branded performance data. This enables more precise analysis of how a brand's own search visibility compares to its performance for broader, non-branded keywords. For content creators targeting AI search, this tool is critical for understanding and optimizing a site's core authority signals versus its discoverability for new topics, informing strategies to build both branded recognition and topical relevance in generative search environments.",SEO; GEO; AI search,45.5,candidate
2026-03-13T05:03:40Z,Search Engine Journal,practitioner,"How AI Automation Turns Static Travel Pages Into Living Content & Experiences via @sejournal, @TaylorDanRW",https://www.searchenginejournal.com/how-ai-automation-turns-static-travel-pages-into-living-content-experiences/568599/,2026-03-12,"The article argues for replacing static travel destination pages with AI-driven content that dynamically adapts to real-time traveler context, such as weather, events, and personal preferences. It finds that this automation transforms standard pages into ""living"" content experiences, which are more engaging and useful for users. For content creators targeting AI search, this implies a strategic shift from creating fixed, one-size-fits-all pages to developing modular, data-integrated content systems that can be dynamically assembled by AI to answer specific, context-aware queries.",SEO; GEO; AI search,45.5,candidate
2026-03-13T05:03:28Z,Search Engine Journal,practitioner,"Google Maps Launches AI Conversational Search With Ask Maps via @sejournal, @MattGSouthern",https://www.searchenginejournal.com/google-maps-launches-ai-conversational-search-with-ask-maps/569585/,2026-03-12,"Google Maps introduced ""Ask Maps,"" a Gemini-powered conversational AI feature for local discovery in the U.S. and India, alongside a U.S. navigation update. This feature allows users to find local information through natural language queries. For content creators, this shift toward AI-driven, conversational search surfaces implies that optimizing for direct, natural language questions and providing structured, locally relevant data is increasingly critical for visibility in AI-powered discovery tools like maps.",SEO; GEO; AI search,45.5,candidate
2026-03-13T05:03:16Z,Search Engine Journal,practitioner,"Formidable Forms Flaw Lets Attackers Pay Less For Expensive Purchases via @sejournal, @martinibuster",https://www.searchenginejournal.com/formidable-forms-flaw-lets-attackers-pay-less-for-expensive-purchases/569665/,2026-03-12,"A vulnerability in the Formidable Forms WordPress plugin was found to allow unauthenticated attackers to manipulate payment amounts, enabling them to pay a small sum while having a larger purchase marked as paid. This flaw, which poses a direct security and financial risk, was measured and reported as a critical e-commerce vulnerability. For content creators targeting AI search, this implies that technical security reporting—detailing specific vulnerabilities, their mechanisms, and real-world impacts—is highly relevant content for AI-powered search surfaces, which prioritize authoritative, factual, and actionable information.",SEO; GEO; AI search,45.5,candidate
2026-03-13T05:01:09Z,Semrush Blog,vendor_research,Search Has Changed. And So Have We.,https://www.semrush.com/blog/semrush-new-brand/,2026-03-12,"Semrush argues that AI-powered search engines like Google's SGE are fundamentally changing how users discover content, shifting from traditional lists of links to direct, conversational answers. This new paradigm means content must be optimized not just for keywords but for being selected as the authoritative source that generative AI models cite within their synthesized responses. For creators, this implies a critical need to focus on Generative Engine Optimization (GEO) strategies—crafting comprehensive, expert-level content that directly answers user queries to secure visibility within these AI-generated overviews, as traditional organic search rankings become less directly influential.",GEO; AI Search; SEO,45.5,candidate
2026-03-12T05:03:08Z,Search Engine Journal,practitioner,"Old Link Building vs. AI Search: How to Earn Top-Tier Media Placements Now via @sejournal, @Michael_Resolve",https://www.searchenginejournal.com/ai-search-link-building-resolve-spa/567924/,2026-03-11,"The article argues that AI-powered search engines like Google's SGE prioritize content demonstrating brand legitimacy and authority over traditional link-building metrics. It finds that earning top-tier media placements now requires a shift toward digital PR strategies that establish genuine expertise and trust. This implies content creators must focus on creating substantively valuable, citable content for reputable publications to signal credibility to AI systems, rather than pursuing sheer link volume or low-quality placements.",SEO; GEO; AI search,45.5,candidate
2026-03-12T05:03:04Z,Search Engine Journal,practitioner,How To Build A ‘Feed-Only’ Performance Max Campaign,https://www.searchenginejournal.com/how-to-build-a-feed-only-performance-max-campaign/568794/,2026-03-11,"The source argues that advertisers can create ""feed-only"" Performance Max campaigns, which restrict the campaign's focus to signals from the product feed itself. This approach is presented as a method to improve efficiency by preventing Google's automation from spreading the advertising budget too broadly across its network. For content creators targeting AI-powered search, this implies that structured, high-quality data feeds are becoming increasingly critical for controlling ad delivery and budget allocation within automated advertising platforms.",SEO; GEO; AI search,45.5,candidate
2026-03-12T05:03:00Z,Search Engine Journal,practitioner,"How To Prove PR Business Value With UTM Parameters & GA4 via @sejournal, @gregjarboe",https://www.searchenginejournal.com/how-to-prove-pr-business-value-with-utm-parameters-ga4/566928/,2026-03-11,"The article argues that in an AI-driven, zero-click search environment where direct traffic attribution is difficult, PR and content teams must systematically use UTM parameters and Google Analytics 4 (GA4) to track earned media. By tagging all shared links, organizations can measure specific user actions and revenue generated from PR-driven visits within GA4, moving beyond vanity metrics. This data directly proves the business value of public relations and earned media by connecting it to conversions. For creators, this implies a necessity for rigorous, campaign-specific tracking to demonstrate ROI and secure budget, as AI summaries often obscure traditional referral sources.",SEO; GEO; AI search,45.5,candidate
