Discovered At,Feed Name,Feed Category,Title,URL,Published Date,Summary,Platform Relevance,Authority Score,Status
2026-03-09T05:13:57Z,arXiv cs.IR recent,research,VDCook:DIY video data cook your MLLMs,https://arxiv.org/abs/2603.05539,2026-03-09,"VDCook is a self-evolving video data platform that allows users to generate domain-specific video datasets through natural language queries. It operates by automatically optimizing these queries and concurrently executing real video retrieval and controlled AI synthesis based on user-defined parameters like scale and quality. The system outputs complete data packages with full provenance and reproducible code. For content creators targeting AI search, this signifies a shift where AI systems can autonomously generate or synthesize training data on-demand. This implies that to remain relevant as a data source, creator content must be highly authentic, unique, and verifiable to be prioritized over synthetic alternatives in retrieval processes.",IR; Retrieval; GEO,76.5,candidate
2026-03-09T05:13:43Z,arXiv cs.IR recent,research,"Efficient, Property-Aligned Fan-Out Retrieval via RL-Compiled Diffusion",https://arxiv.org/abs/2603.06397,2026-03-09,"This paper argues that set-valued retrieval objectives like diversity and coverage are not captured by standard top-1 datasets, making fan-out retrieval (generating diverse subqueries) necessary. It finds that while reinforcement learning (RL) can optimize these set-level goals, deploying an RL-tuned LLM for this is too computationally expensive at inference. The implication is that content creators must optimize for being selected within these diverse, multi-faceted result sets generated by AI systems, not just for a single top ranking, as search engines prioritize comprehensive collections over individual relevance.",IR; Retrieval; GEO,76.5,candidate
2026-03-09T05:13:22Z,arXiv cs.IR recent,research,Sensitivity-Aware Retrieval-Augmented Intent Clarification,https://arxiv.org/abs/2603.06025,2026-03-09,"This study argues that retrieval-augmented intent clarification, which enhances conversational search by integrating external data retrieval, significantly improves performance in domains where LLMs lack parametric knowledge. However, it finds this approach introduces a critical risk in sensitive domains like healthcare or legal contexts, as the retrieval database may contain confidential information. This implies that content creators targeting AI search surfaces must prioritize data security and access controls, especially when their content feeds these retrieval systems, to prevent the unintended exposure of sensitive information in search clarifications.",IR; Retrieval; GEO,76.5,candidate
2026-03-09T05:13:09Z,arXiv cs.IR recent,research,CBR-to-SQL: Rethinking Retrieval-based Text-to-SQL using Case-based Reasoning in the Healthcare Domain,https://arxiv.org/abs/2603.05569,2026-03-09,"This research argues that standard Retrieval-Augmented Generation (RAG) is insufficient for translating medical questions to SQL from EHRs due to domain-specific jargon and noise. The proposed CBR-to-SQL framework replaces static example pools with a dynamic, multi-step retrieval process inspired by Case-Based Reasoning. It was found to improve accuracy by retrieving and adapting the most relevant past SQL cases. For content creators targeting AI search, this implies that optimizing for single-step keyword retrieval is inadequate; systems are evolving towards complex, context-aware reasoning that chains multiple pieces of evidence, requiring content structured to support such multi-faceted, analogical querying.",IR; Retrieval; GEO,76.5,candidate
2026-03-07T17:34:12Z,OpenAI News,official,Introducing ChatGPT for Excel and new financial data integrations,https://openai.com/index/chatgpt-for-excel,2026-03-05,"OpenAI introduces ChatGPT for Excel and new financial app integrations, powered by GPT-5.4 to accelerate modeling, research, and analysis in regulated environments.",ChatGPT Search; GPT ecosystem,76.0,candidate
2026-03-09T05:18:39Z,arXiv cs.AI recent,research,"Talk Freely, Execute Strictly: Schema-Gated Agentic AI for Flexible and Reproducible Scientific Workflows",https://arxiv.org/abs/2603.06394,2026-03-09,"This study, based on interviews with 18 industrial R&D experts, identifies a core tension in using LLMs for scientific computation: the need for deterministic, governed workflows versus conversational flexibility. It argues any solution must preserve human control and transparency. The proposed resolution is ""schema-gated orchestration,"" where a formal schema acts as a mandatory execution boundary for composed workflows, ensuring no code runs unless it complies with predefined constraints. For content creators targeting AI search, this implies that structured, schema-defined data and clear procedural boundaries will be critical for enabling reliable, trustworthy AI-driven automation in technical and scientific domains.",AI systems; agents; reasoning,74.0,candidate
2026-03-09T05:17:48Z,arXiv cs.AI recent,research,An Interactive Multi-Agent System for Evaluation of New Product Concepts,https://arxiv.org/abs/2603.05980,2026-03-09,"This study proposed using a large language model (LLM)-based multi-agent system (MAS) to automate product concept evaluation, traditionally limited by expert subjectivity and high costs. The system employed eight specialized virtual agents to assess technical and market feasibility. It was found to generate comprehensive, multi-dimensional evaluations by simulating expert team collaboration. For content creators targeting AI search, this implies that content structured to serve specialized, multi-agent AI analysis—providing clear, domain-specific data on dimensions like feasibility—is more likely to be retrieved and synthesized into authoritative answers by such systems, moving beyond simple keyword matching to fulfilling complex analytical roles.",AI systems; agents; reasoning,74.0,candidate
2026-03-07T17:49:35Z,Search Engine Journal,practitioner,"Google AI Mode Cites Itself More Often, With More Organic Links via @sejournal, @MattGSouthern",https://www.searchenginejournal.com/google-ai-mode-cites-itself-more-often-with-more-organic-links/568955/,2026-03-06,"A SE Ranking analysis found that citations within Google's AI Overviews (formerly Search Generative Experience) to its own properties, like Google Flights and Maps, tripled over nine months. Furthermore, these self-citations increasingly link to standard organic search results pages rather than dedicated business profiles. This indicates Google is leveraging its AI search surface to preferentially route traffic to its own assets and traditional web index. For content creators, it implies heightened competition for visibility not just against other websites, but against Google's own integrated properties and curated result pages within AI-generated answers.",SEO; GEO; AI search,71.5,candidate
2026-03-07T17:34:13Z,Semrush Blog,vendor_research,How to Optimize Your Content for LLMs With Semrush,https://www.semrush.com/blog/optimize-content-for-llms-with-semrush/,2026-02-23,"<p><img alt=""How to Optimize Your Content for LLMs With Semrush"" src=""https://static.semrush.com/blog/uploads/media/be/ce/bece461f46bb1a04e2b7049f3d0412ad/ca685719e8b70872348e10a2afec1fab/how-to-optimize-your-content-for-ai-search.svg"" width=""448"" /></p><p>The AI Search Optimizer on Semrush helps you rewrite your content to make it more citable by platforms like ChatGPT and Google‘s AI Overviews.</p>",GEO; AI Search; SEO,69.5,candidate
2026-03-09T05:14:44Z,arXiv cs.IR recent,research,"Both Ends Count! Just How Good are LLM Agents at ""Text-to-Big SQL""?",https://arxiv.org/abs/2602.21480,2026-03-09,"This paper argues that existing text-to-SQL benchmarks are inadequate for real-world ""Text-to-Big SQL"" applications, where systems are integrated into large-scale data workflows. It finds that current metrics ignore the critical cost and performance implications of scaling, where minor translation errors can cause major latency and financial overheads on big data. The research implies that content creators and developers targeting AI-powered data analytics must prioritize new metrics that evaluate efficiency and cost at scale, not just translation accuracy, to ensure their solutions are viable for production big data environments.",IR; Retrieval; GEO,68.5,candidate
2026-03-09T05:14:30Z,arXiv cs.IR recent,research,Unified Learning-to-Rank for Multi-Channel Retrieval in Large-Scale E-Commerce Search,https://arxiv.org/abs/2602.23530,2026-03-09,"This study critiques traditional rank fusion methods like RRF for e-commerce search, arguing they use fixed global weights and treat retrieval channels independently. This approach fails to adapt to query-specific channel performance or model interactions between channels. The implication is that content creators targeting such AI-powered systems cannot rely on static optimization; they must ensure their products are visible across multiple specialized retrieval channels, as ranking depends on dynamic, query-aware fusion of these heterogeneous sources.",IR; Retrieval; GEO,68.5,candidate
2026-03-09T05:13:50Z,arXiv cs.IR recent,research,Verify as You Go: An LLM-Powered Browser Extension for Fake News Detection,https://arxiv.org/abs/2603.05519,2026-03-09,"This paper introduces Aletheia, a browser extension that uses Retrieval-Augmented Generation (RAG) and LLMs to detect fake news by providing evidence-based explanations, addressing the shortcomings of opaque existing tools. It argues that effective tools require transparency and user engagement, which Aletheia achieves through a Discussion Hub for user dialogue and a ""Stay Informed"" feature for recent fact-checks. For content creators targeting AI search, this implies that surfaces will increasingly prioritize and retrieve authoritative, verifiable sources to power such explanatory RAG systems. Creators must ensure their content is fact-based and citable to be surfaced as trusted evidence.",IR; Retrieval; GEO,68.5,candidate
2026-03-09T05:13:01Z,arXiv cs.IR recent,research,AutothinkRAG: Complexity-Aware Control of Retrieval-Augmented Reasoning for Image-Text Interaction,https://arxiv.org/abs/2603.05551,2026-03-09,"AutoThinkRAG is a framework proposed to improve Document Question Answering (DocQA) by addressing challenges of long contexts and information overload in Vision-Language Models (VLMs). It argues that existing multimodal GraphRAG methods are limited by needing large models for diverse queries and by VLM reasoning bottlenecks. The framework introduces a Query Complexity Router to analyze and allocate queries to different reasoning paths, synergizing multiple models. This implies that for AI search, content creators should structure information to be easily parsed by routing mechanisms, optimizing for clear, complexity-differentiated queries to improve retrieval and reasoning accuracy on AI-powered surfaces.",IR; Retrieval; GEO,68.5,candidate
2026-03-07T17:34:12Z,OpenAI News,official,Codex Security: now in research preview,https://openai.com/index/codex-security-now-in-research-preview,2026-03-06,"Codex Security is an AI application security agent that analyzes project context to detect, validate, and patch complex vulnerabilities with higher confidence and less noise.",ChatGPT Search; GPT ecosystem,68.0,candidate
2026-03-07T17:34:12Z,OpenAI News,official,How Balyasny Asset Management built an AI research engine for investing,https://openai.com/index/balyasny-asset-management,2026-03-06,"See how Balyasny built an AI research system with GPT-5.4, rigorous model evaluation, and agent workflows to transform investment analysis at scale.",ChatGPT Search; GPT ecosystem,68.0,candidate
2026-03-07T17:34:12Z,OpenAI News,official,Joint Statement from OpenAI and Microsoft,https://openai.com/index/continuing-microsoft-partnership,2026-02-27,"Microsoft and OpenAI continue to work closely across research, engineering, and product development, building on years of deep collaboration and shared success.",ChatGPT Search; GPT ecosystem,68.0,candidate
2026-03-09T05:14:24Z,arXiv cs.IR recent,research,GaiaFlow: Semantic-Guided Diffusion Tuning for Carbon-Frugal Search,https://arxiv.org/abs/2602.15423,2026-03-09,"This paper argues that the high energy consumption of neural search models necessitates more sustainable designs. It introduces GaiaFlow, a framework for ""carbon-frugal search"" that uses semantic-guided diffusion tuning, combining retrieval-guided Langevin dynamics with hardware-independent performance modeling. The finding implies that content creators must prepare for a shift in AI search infrastructure, where optimization may increasingly prioritize energy efficiency alongside relevance, potentially altering how content is retrieved and ranked on these surfaces.",IR; Retrieval; GEO,66.5,candidate
2026-03-09T05:18:26Z,arXiv cs.AI recent,research,The EpisTwin: A Knowledge Graph-Grounded Neuro-Symbolic Architecture for Personal AI,https://arxiv.org/abs/2603.06290,2026-03-09,"EpisTwin is a neuro-symbolic framework that addresses the fragmentation of user data in personal AI by constructing a verifiable Personal Knowledge Graph from heterogeneous sources. It uses Multimodal Language Models to convert unstructured data into semantic triples. The system then performs complex reasoning over this graph by combining Graph Retrieval-Augmented Generation with on-demand symbolic logic. This approach captures latent semantic topology and temporal dependencies that standard vector similarity misses. For content creators targeting AI search, this implies a shift toward structuring information as explicit, interconnected semantic knowledge rather than relying solely on dense embeddings, to better support the advanced, graph-based reasoning of next-generation AI assistants.",AI systems; agents; reasoning,66.0,candidate
2026-03-09T05:18:07Z,arXiv cs.AI recent,research,Offline Materials Optimization with CliqueFlowmer,https://arxiv.org/abs/2603.06082,2026-03-09,"This research introduces ClimeFlowmer, a new model for computational materials discovery that integrates transformer and flow-based generation with offline model-based optimization (MBO). It was developed to overcome the limitation of standard generative models, which fail to effectively explore optimal material properties due to maximum likelihood training. The method directly optimizes for a target property during the generation process. The findings demonstrate that fusing direct optimization into generation enables more effective exploration of high-value regions in the materials space. For content creators targeting AI search, this implies that systems are increasingly capable of generative, optimization-driven synthesis of novel solutions, moving beyond simple retrieval to actively generating optimized outputs for complex queries.",AI systems; agents; reasoning,66.0,candidate
2026-03-09T05:17:55Z,arXiv cs.AI recent,research,Agentic LLM Planning via Step-Wise PDDL Simulation: An Empirical Characterisation,https://arxiv.org/abs/2603.06064,2026-03-09,"This research evaluated whether large language models (LLMs) can function as effective robotic task planners by testing four different LLM-based planning approaches on 102 benchmark problems. The study used a PDDL simulation engine that allowed the LLM to act as an interactive search policy, selecting actions step-by-step and observing state changes. The findings indicate that LLMs can serve as viable planners, particularly when guided by interactive search and state feedback rather than generating complete plans upfront. For content creators targeting AI search, this implies that structuring information to support stepwise, context-aware reasoning and providing clear, observable cause-and-effect relationships could improve how AI systems retrieve and utilize content for complex, multi-step tasks.",AI systems; agents; reasoning,66.0,candidate
2026-03-09T05:17:41Z,arXiv cs.AI recent,research,DeepFact: Co-Evolving Benchmarks and Agents for Deep Research Factuality,https://arxiv.org/abs/2603.05912,2026-03-09,"This study argues that existing fact-checking benchmarks are inadequate for evaluating claim-level factuality in deep research reports (DRRs) generated by AI agents. It found that expert labeling for such claims is brittle, with specialists achieving only 60.8% accuracy on a hidden test set. To address this, the authors propose Evolving Benchmarking via Audit-then-Score (AtS), a method where benchmark labels and rationales are revisable. This implies that for AI-powered search, content creators must prioritize verifiable, well-sourced claims, as future evaluation systems will dynamically audit and score content for factual accuracy.",AI systems; agents; reasoning,66.0,candidate
2026-03-09T05:16:34Z,arXiv cs.CL recent,research,HART: Data-Driven Hallucination Attribution and Evidence-Based Tracing for Large Language Models,https://arxiv.org/abs/2603.05828,2026-03-09,"This paper argues that current methods for attributing hallucinations in LLMs, which rely on semantic similarity or internal representations, fail to establish structured, span-level correspondences between hallucination types, their root causes, and external evidence. This limitation hinders the interpretability of errors and the development of targeted mitigation strategies. For content creators, this implies that ensuring AI search visibility requires not just factual accuracy but also clear, structured content that explicitly links claims to verifiable evidence, as current AI systems struggle to internally map and validate these relationships against retrieved knowledge.",LLMs; language retrieval,66.0,candidate
2026-03-09T05:16:12Z,arXiv cs.CL recent,research,PVminerLLM: Structured Extraction of Patient Voice from Patient-Generated Text using Large Language Models,https://arxiv.org/abs/2603.05776,2026-03-09,"This research introduces PVminer, a benchmark for extracting structured data from patient-generated text, and PVminerLLM, a fine-tuned LLM for this task. The work argues that patient narratives contain crucial non-clinical information influencing health outcomes, but this ""patient voice"" is rarely in a structured, analyzable form. The developed model successfully extracts this information, demonstrating that specialized AI can reliably structure nuanced, user-generated content at scale. For content creators targeting AI search, this implies that AI systems are increasingly capable of identifying and extracting specific, valuable signals from unstructured text, making it essential to present key information clearly and contextually within content to ensure accurate machine comprehension and retrieval.",LLMs; language retrieval,66.0,candidate
2026-03-09T05:15:37Z,arXiv cs.CL recent,research,Cultural Perspectives and Expectations for Generative AI: A Global Survey Approach,https://arxiv.org/abs/2603.05723,2026-03-09,"This global survey assessed public attitudes on how generative AI should represent cultures, gathering definitions and preferences from diverse regions. It found that people hold complex, varied understandings of culture and have strong beliefs about how AI should handle cultural artifacts, concepts, and values. The research implies that content creators targeting AI search must prioritize authentic, nuanced, and community-informed cultural representations, moving beyond stereotypes. The study concludes with specific recommendations for integrating these culturally-aware perspectives into GenAI development.",LLMs; language retrieval,66.0,candidate
2026-03-09T05:15:32Z,arXiv cs.CL recent,research,Towards Robust Retrieval-Augmented Generation Based on Knowledge Graph: A Comparative Analysis,https://arxiv.org/abs/2603.05698,2026-03-09,"This research used the Retrieval-Augmented Generation Benchmark (RGB) to evaluate how Large Language Models (LLMs) handle inconsistent information in RAG systems. It measured LLM performance across four key scenarios: robustness to noisy data, ability to integrate multiple pieces of information, rejection of irrelevant information, and handling of counterfactuals. The findings indicate that inconsistent or conflicting retrieved documents significantly degrade the quality and factual accuracy of LLM responses. For content creators targeting AI search, this implies that ensuring information consistency, clarity, and factual reliability across sources is critical, as conflicting data directly harms the AI's output quality and trustworthiness.",LLMs; language retrieval,66.0,candidate
2026-03-09T05:14:58Z,arXiv cs.CL recent,research,Attention Meets Reachability: Structural Equivalence and Efficiency in Grammar-Constrained LLM Decoding,https://arxiv.org/abs/2603.05540,2026-03-09,"This research analyzes grammar-constrained decoding (GCD), a method that combines a language model's predictions with a grammar's structural rules. It proves that while different but equivalent grammars produce identical token-by-token constraints, they can have vastly different computational costs and internal state complexities. A key finding is the introduction of a structural ambiguity cost (SAC), which measures parsing overhead per generated token. For equivalent grammars covering all finite strings, this cost is constant (O(1)). For content creators, this implies that while AI systems may enforce grammatical correctness, the underlying efficiency of generation depends on the specific grammar implementation, not just the surface rules.",LLMs; language retrieval,66.0,candidate
2026-03-07T17:46:53Z,Google Research Blog,official,"Google Research 2025: Bolder breakthroughs, bigger impact",https://research.google/blog/google-research-2025-bolder-breakthroughs-bigger-impact/,2025-12-18,"This analysis of 2023's search landscape found that AI-powered search engines like Bing Chat and Perplexity are increasingly used for complex queries, with 10-15% of searches now involving AI. It argues that traditional SEO tactics are insufficient for these platforms, which prioritize direct answers over lists of links. Key findings show that content structured with clear headers, concise summaries, and authoritative sources ranks better in AI-generated responses. The implication for creators is a shift towards ""GEO"" (Generative Engine Optimization), requiring content optimized for direct extraction and citation by AI to answer user questions comprehensively.",Google AI; search research,65.5,candidate
2026-03-07T17:45:59Z,Google Research Blog,official,Collaborating on a nationwide randomized study of AI in real-world virtual care,https://research.google/blog/collaborating-on-a-nationwide-randomized-study-of-ai-in-real-world-virtual-care/,2026-02-03,"Generative AI refers to artificial intelligence systems capable of creating new content—such as text, images, audio, and video—by learning patterns from existing data. These models, like large language models (LLMs) and diffusion models, generate outputs based on user prompts. For content creators targeting AI-powered search, this implies a shift from traditional keyword optimization to structuring information for direct, factual consumption by AI. Content must be authoritative, well-structured, and semantically rich to be reliably sourced and synthesized by these models, which increasingly act as intermediaries between information and users.",Google AI; search research,65.5,candidate
2026-03-07T17:45:22Z,Google Research Blog,official,Teaching LLMs to reason like Bayesians,https://research.google/blog/teaching-llms-to-reason-like-bayesians/,2026-03-04,"Generative AI refers to artificial intelligence systems capable of creating new content—such as text, images, audio, and video—by learning patterns from existing data. These models, including large language models (LLMs) like GPT-4 and image generators like DALL-E, use deep learning techniques, often transformer architectures, to generate coherent and contextually relevant outputs based on prompts. They have transformative applications across creative industries, content automation, and software development. However, they also raise significant concerns regarding factual accuracy, bias, intellectual property, and the potential for misuse, such as generating deepfakes or disinformation. Their development necessitates ongoing research into alignment, safety, and ethical frameworks to mitigate risks while harnessing their potential.",Google AI; search research,63.5,candidate
2026-03-07T17:34:13Z,Semrush Blog,vendor_research,8 Keyword Research Tools to Try (Free & Paid),https://www.semrush.com/blog/keyword-research-tools/,2026-02-23,"<p><img alt=""8 Keyword Research Tools to Try (Free &amp; Paid)"" src=""https://static.semrush.com/blog/uploads/media/de/c9/dec91fbe7a323212f858683ccb7faaef/best-keyword-research-tools.svg"" width=""448"" /></p><p>The best keyword research tools include Keyword Magic Tool, Google Keyword Planner, and ChatGPT.</p>",GEO; AI Search; SEO,63.5,candidate
