Discovered At,Feed Name,Feed Category,Title,URL,Published Date,Summary,Platform Relevance,Authority Score,Status
2026-03-07T17:50:59Z,Search Engine Journal,practitioner,"Seraphinite Accelerator WordPress Plugin Vulnerabilities Affect 60K Sites via @sejournal, @martinibuster",https://www.searchenginejournal.com/seraphinite-accelerator-vulnerabilities/568755/,2026-03-04,"Security researchers identified two vulnerabilities in the Seraphinite Accelerator WordPress plugin, potentially impacting up to 60,000 website installations. The flaws could allow attackers to perform stored cross-site scripting (XSS) and gain unauthorized administrative access. This finding implies that content creators must prioritize website security and plugin maintenance, as compromised sites risk being de-indexed or penalized by search engines, directly harming visibility on all search surfaces, including AI-powered ones. Secure, stable sites are a foundational requirement for reliable content discovery.",SEO; GEO; AI search,45.5,candidate
2026-03-07T17:50:54Z,Search Engine Journal,practitioner,"Yoast SEO’s New Schema Aggregator Improves Entity Disambiguation via @sejournal, @martinibuster",https://www.searchenginejournal.com/yoast-seos-new-schema-aggregator-improves-entity-disambiguation/568764/,2026-03-04,"Yoast SEO introduced a new schema aggregator feature designed to consolidate a website's structured data and clarify the relationships between key entities like authors, articles, and organizations. This technical improvement aims to enhance entity disambiguation, helping search engines better understand and accurately represent site content. For content creators, this implies that properly implementing such structured data tools is becoming critical for visibility in AI-powered search, as these systems increasingly rely on clear, unambiguous entity relationships to generate precise answers and summaries.",SEO; GEO; AI search,45.5,candidate
2026-03-07T17:50:44Z,Search Engine Journal,practitioner,"SEO Vs. PPC Strategy: What’s Right For Your Business? via @sejournal, @brookeosmundson",https://www.searchenginejournal.com/seo-vs-ppc-strategy-whats-right-for-your-business/567778/,2026-03-04,"The article analyzes the distinct scaling dynamics and competitive roles of SEO (search engine optimization) and PPC (pay-per-click) advertising for business growth. It argues that while PPC delivers immediate, controllable traffic and direct competition for paid placements, SEO builds sustainable, long-term organic visibility that compounds over time. The findings imply content creators must strategically allocate resources: PPC for testing and short-term goals, and SEO-focused, high-quality content for enduring authority and cost-efficient growth in AI-powered search, where organic visibility remains paramount.",SEO; GEO; AI search,45.5,candidate
2026-03-07T17:50:39Z,Search Engine Journal,practitioner,"Why Most Enterprise SEO Operating Models Are Structurally Broken via @sejournal, @billhunt",https://www.searchenginejournal.com/why-most-enterprise-seo-operating-models-are-structurally-broken/566075/,2026-03-04,"The article argues that traditional enterprise SEO is flawed as a reactive audit function. It advocates for embedding SEO as a core capability from the outset to shape content structure and technical eligibility. This shift implies that content creators must prioritize SEO fundamentals—like site architecture and crawlability—during initial development, not as a post-hoc fix, to effectively reach AI-driven search surfaces where foundational quality is paramount.",SEO; GEO; AI search,45.5,candidate
2026-03-07T17:50:35Z,Search Engine Journal,practitioner,Google Zero Is A Lie,https://www.searchenginejournal.com/google-zero-is-a-lie/568668/,2026-03-04,"The article argues that the ""Google Zero"" narrative—the idea that organic search traffic has fallen to zero for many sites—is inaccurate. It contends that while traffic volatility has increased, significant organic visibility and clicks still exist. The analysis implies that for content creators, the focus should shift from fearing total obsolescence to adapting strategies for AI-enhanced search results, such as optimizing for featured snippets and direct answers, and creating comprehensive, authoritative content that satisfies both user intent and evolving algorithmic preferences.",SEO; GEO; AI search,45.5,candidate
2026-03-07T17:50:25Z,Search Engine Journal,practitioner,"WordPress Releases AI Plugins For Anthropic Claude, Google Gemini, And OpenAI via @sejournal, @martinibuster",https://www.searchenginejournal.com/wordpress-releases-ai-plugins-for-anthropic-claude-google-gemini-and-openai/568822/,2026-03-04,"WordPress has released three official plugins enabling direct integration of Anthropic's Claude, Google's Gemini, and OpenAI models into websites. This allows site owners to embed AI assistants and features directly within their WordPress environments. For content creators targeting AI search, this development signifies a shift where AI models can directly access and process a site's content via these integrations, potentially influencing how that content is understood and surfaced in generative search results. It implies creators must consider optimizing not just for traditional SEO but also for direct AI interaction and structured data accessibility to ensure accurate representation within these AI ecosystems.",SEO; GEO; AI search,45.5,candidate
2026-03-07T17:50:19Z,Search Engine Journal,practitioner,"Google Removes JavaScript SEO Warning, Says It’s Outdated via @sejournal, @MattGSouthern",https://www.searchenginejournal.com/google-removes-javascript-seo-warning-says-its-outdated/568829/,2026-03-05,"Google removed its long-standing guidance warning against JavaScript for SEO, stating the advice is outdated because its systems have effectively rendered and indexed JavaScript content for years. This action signifies that Google's crawlers can now reliably process JavaScript-heavy websites, a major shift from past technical limitations. For content creators, this implies that modern JavaScript frameworks are no longer an inherent barrier to indexing and ranking in Google Search, allowing for greater development flexibility without sacrificing core SEO performance. The focus for optimization should remain on content quality and technical performance, not on avoiding JavaScript.",SEO; GEO; AI search,45.5,candidate
2026-03-07T17:50:14Z,Search Engine Journal,practitioner,"If AI Can’t Read Your CMS, It Can’t Recommend Your Brand [Webinar] via @sejournal, @lorenbaker",https://www.searchenginejournal.com/if-ai-cant-read-your-cms-it-cant-recommend-your-brand/568601/,2026-03-05,"The source argues that AI-driven search is already critical for brand discovery, requiring content structured for machine interpretation, not just traditional page rankings. It finds that many enterprise CMS platforms are outdated, built for an earlier SEO era focused on pages rather than structured data. This implies that marketing leaders must treat this as a platform-level issue: if a CMS cannot clearly communicate semantic meaning to AI systems, the brand's visibility in AI-powered search surfaces is fundamentally at risk before users even reach the site.",SEO; GEO; AI search,45.5,candidate
2026-03-07T17:50:10Z,Search Engine Journal,practitioner,"Why Google Discover Is No Longer Just For Publishers via @sejournal, @theshelleywalsh",https://www.searchenginejournal.com/why-google-discover-is-no-longer-just-for-publishers/568777/,2026-03-05,"The source argues that Google Discover, a personalized content feed, is now a strategic channel for both publishers and brands, not just publishers. It measures the platform's utility for driving traffic but cautions against over-reliance on it as a sole strategy due to its inherent volatility from algorithmic personalization. For content creators targeting AI-powered search, this implies a need to diversify traffic sources and optimize for engaging, topical content that aligns with Discover's interest-based recommendations, while not depending on it exclusively for audience reach.",SEO; GEO; AI search,45.5,candidate
2026-03-07T17:49:50Z,Search Engine Journal,practitioner,"Google Says Disavow Links If You’re Conflicted And Need To Be Sure via @sejournal, @martinibuster",https://www.searchenginejournal.com/google-says-disavow-links/568928/,2026-03-06,"Google's John Mueller stated that while most websites do not need to use a disavow file for backlinks, creators should use it if they are uncertain and want to be sure. This indicates that for AI-powered search, creators should focus on proactive, high-quality link-building rather than reactive disavowal, as algorithmic trust in natural link profiles reduces the need for manual intervention unless clear spam is present.",SEO; GEO; AI search,45.5,candidate
2026-03-07T17:49:45Z,Search Engine Journal,practitioner,"AI Max Brand Controls Expand, VRC Non-Skip Ads Go Global – PPC Pulse via @sejournal, @brookeosmundson",https://www.searchenginejournal.com/ppc-pulse-ai-max-brand-controls-expand-vrc-non-skip-ads-go-global/568890/,2026-03-06,"Google announced updates to its AI-powered Performance Max campaigns, expanding brand safety controls that allow advertisers to block AI-generated content from appearing alongside specific keywords or sensitive topics. This development, alongside the global rollout of unskippable 30-second video ads on YouTube, indicates a tightening of platform governance over AI-generated ad content and user experience. For content creators and advertisers, this implies that while AI tools are increasingly integrated into ad platforms, maintaining direct brand safety oversight and adapting to stricter, non-skippable video ad formats will be crucial for campaigns targeting AI-driven search and discovery surfaces.",SEO; GEO; AI search,45.5,candidate
2026-03-07T17:34:13Z,Semrush Blog,vendor_research,SEO Writing: 16 Tips to Create Optimized Content,https://www.semrush.com/blog/seo-writing/,2026-03-02,"<p><img alt=""SEO Writing: 16 Tips to Create Optimized Content"" src=""https://static.semrush.com/blog/uploads/media/e1/98/e198dd5ec6a06564971354b97af646b8/create-seo-friendly-content.svg"" width=""448"" /></p><p>Learn 16 practical tips for writing search-optimized content that gains visibility and drives traffic.</p>",GEO; AI Search; SEO,45.5,candidate
2026-03-07T17:34:13Z,Semrush Blog,vendor_research,What Is Keyword Search Volume? + 5 Free Tools to Check It,https://www.semrush.com/blog/keyword-search-volume/,2026-02-26,"<p><img alt=""What Is Keyword Search Volume? + 5 Free Tools to Check It"" src=""https://static.semrush.com/blog/uploads/media/41/da/41da07da5ddc883acb17c00519904240/keyword-search-volum.svg"" width=""448"" /></p><p>Keyword search volume is the number of monthly searches for a keyword. Discover 5 tools for checking it.</p>",GEO; AI Search; SEO,45.5,candidate
2026-03-07T17:34:13Z,Semrush Blog,vendor_research,What Is a Title Tag? How to Optimize Your SEO Titles,https://www.semrush.com/blog/title-tag/,2026-02-24,"<p><img alt=""What Is a Title Tag? How to Optimize Your SEO Titles"" src=""https://static.semrush.com/blog/uploads/media/7e/42/7e4270cb0db79e40b41144a38515983e/how-to-write-title-tags.svg"" width=""448"" /></p><p>A title tag is an HTML element that provides a page title for search engines and web browsers to use.</p>",GEO; AI Search; SEO,45.5,candidate
2026-03-07T17:34:13Z,Semrush Blog,vendor_research,301 Redirects: How to Use Them & How They Affect SEO,https://www.semrush.com/blog/301-redirects/,2026-02-18,"<p><img alt=""301 Redirects: How to Use Them &amp; How They Affect SEO"" src=""https://static.semrush.com/blog/uploads/media/a5/ca/a5caf9f946b71bff80d9d89fffe948c7/301-redirect.svg"" width=""448"" /></p><p>A 301 redirect sends users and search engines from an old URL to a new one, passing on the SEO value.</p>",GEO; AI Search; SEO,45.5,candidate
2026-03-07T17:34:13Z,Semrush Blog,vendor_research,What Is Google AI Mode? (+ How to Optimize for It in 2026),https://www.semrush.com/blog/google-ai-mode/,2026-02-13,"<p><img alt=""What Is Google AI Mode? (+ How to Optimize for It in 2026)"" src=""https://static.semrush.com/blog/uploads/media/ed/65/ed65478009666da0d3d9c8ac23f8b6cd/ab94da6614a366773300f63a969b17f5/google-ai-mode.svg"" width=""448"" /></p><p>Learn what Google AI Mode is, how it changes SEO, and the key steps you can take to get your content featured in it.</p>",GEO; AI Search; SEO,45.5,candidate
2026-03-07T17:34:13Z,Semrush Blog,vendor_research,12 Alternative Search Engines to Try (Instead of Google),https://www.semrush.com/blog/alternative-search-engines/,2026-02-13,"<p><img alt=""12 Alternative Search Engines to Try (Instead of Google)"" src=""https://static.semrush.com/blog/uploads/media/52/47/5247c1b2a8ac602a03dc5f176b230bc7/alternative-search-engines.svg"" width=""448"" /></p><p>Find the best search engines to use other than Google, including privacy-focused and AI-powered options.</p>",GEO; AI Search; SEO,45.5,candidate
2026-03-07T17:34:13Z,Semrush Blog,vendor_research,How to Conduct an AI Visibility Audit with Semrush One,https://www.semrush.com/blog/ai-visibility-audit-with-semrush-one/,2026-02-12,"<p><img alt=""How to Conduct an AI Visibility Audit with Semrush One"" src=""https://static.semrush.com/blog/uploads/media/27/e4/27e473cce9e5171c7dd2150efa005e71/4775b57b0a1acc76a9e3992c5b6a967a/conduct-an-ai-visibility-audit-with-semrush.svg"" width=""448"" /></p><p>Is your current website health and content strategy set up to help you succeed in AI search?</p>",GEO; AI Search; SEO,45.5,candidate
2026-03-07T17:34:13Z,Semrush Blog,vendor_research,Google Search Console: The Ultimate Guide for 2026,https://www.semrush.com/blog/google-search-console/,2026-02-12,"<p><img alt=""Google Search Console: The Ultimate Guide for 2026"" src=""https://static.semrush.com/blog/uploads/media/ca/fb/cafb3ffdccf7d0e673de046d2833e21d/definitive-guide-to-google-search-console.svg"" width=""448"" /></p><p>Learn how to use Google Search Console to monitor performance, fix issues, and improve visibility.</p>",GEO; AI Search; SEO,45.5,candidate
2026-03-09T05:18:46Z,arXiv cs.AI recent,research,Boosting deep Reinforcement Learning using pretraining with Logical Options,https://arxiv.org/abs/2603.06565,2026-03-09,"This research proposes H^2RL, a hybrid method combining symbolic logic with deep reinforcement learning (RL) to correct agent misalignment caused by over-exploiting early rewards. It argues that purely symbolic approaches are hard to scale, while standard deep RL agents often converge on short-term, suboptimal policies. The framework uses a logical, option-based pretraining stage to inject structured objectives and plans into a neural policy, steering learning away from these local optima without losing expressive power. For content creators targeting AI search, this implies that systems may increasingly prioritize content demonstrating logical, structured reasoning and long-term planning over content optimized solely for immediate, superficial engagement signals.",AI systems; agents; reasoning,40.0,candidate
2026-03-09T05:18:33Z,arXiv cs.AI recent,research,SAHOO: Safeguarded Alignment for High-Order Optimization Objectives in Recursive Self-Improvement,https://arxiv.org/abs/2603.06333,2026-03-09,"This paper introduces SAHOO, a framework to monitor and control alignment drift in AI systems that engage in recursive self-improvement. It measures drift using a multi-signal Goal Drift Index (GDI) and enforces safety constraints. The study, conducted across 189 tasks in code generation, math, and truthfulness, found that SAHOO produced substantial quality improvements while preventing harmful drift. For content creators targeting AI search, this implies that future AI-generated or AI-optimized content will increasingly be subject to internal, multi-faceted verification systems. To remain visible, content must not only be high-quality but also demonstrably aligned with core safety and truthfulness invariants that these systems are designed to preserve.",AI systems; agents; reasoning,40.0,candidate
2026-03-09T05:17:24Z,arXiv cs.AI recent,research,Reasoning Models Struggle to Control their Chains of Thought,https://arxiv.org/abs/2603.05706,2026-03-09,"This research measured the ""CoT controllability"" of AI reasoning models—their ability to follow specific instructions about *what* to verbalize in their internal chain-of-thought (CoT) while solving problems. It found that models have significantly lower controllability over their reasoning process than over their final output; for example, Claude Sonnet 4.5 succeeded only 2.7% of the time on CoT control tasks versus 61.9% for final-answer control. This implies that for AI-powered search, while models can be directed to produce certain final answers, their underlying reasoning remains largely uncontrollable and may not align with the instructed constraints, potentially undermining the reliability of using CoT for monitoring or optimization.",AI systems; agents; reasoning,40.0,candidate
2026-03-09T05:15:45Z,arXiv cs.CL recent,research,Structured Multidimensional Representation Learning for Large Language Models,https://arxiv.org/abs/2603.05727,2026-03-09,"This research introduces a Tensor Transformer architecture that addresses parameter growth and redundancy in standard Transformers by applying a structured spectral factorization to the embedding space. It reshapes token representations into spectral tensor slices and performs core operations in the transform domain, decomposing the encoder into independent spectral sub-transformers while preserving original Transformer semantics. The findings demonstrate that this L-Transformer is spectrally equivalent to the standard model but with significantly reduced parameters. For content creators targeting AI search, this implies that future AI models may become more parameter-efficient without losing capability, potentially altering how these systems process and retrieve information, though the core need for high-quality, semantically clear content remains fundamental.",LLMs; language retrieval,40.0,candidate
2026-03-07T17:54:20Z,Stratechery,analyst,2026.08: Losing in the Attention Economy,https://stratechery.com/2026/losing-in-the-attention-economy/,2026-02-20,"This source, a weekly digest from Stratechery, analyzed three distinct industry trends: a critique of the video game industry's current state, an assessment of the NBA's present operational challenges, and an examination of Shopify's role in shaping e-commerce's future. The content argues for specific theses on each topic's underlying dynamics and strategic implications. For content creators targeting AI search, this demonstrates that in-depth, analytical commentary on niche business and technology sectors is valued and surfaced by generative engines. It implies that authoritative, thesis-driven analysis on specialized topics, rather than generic summaries, is effective for visibility on AI-powered search surfaces.",AI strategy; platform dynamics,40.0,candidate
2026-03-07T17:54:14Z,Stratechery,analyst,"Another Viral AI Doomer Article, The Fundamental Error, DoorDash’s AI Advantages",https://stratechery.com/2026/another-viral-ai-doomer-article-the-fundamental-error-doordashs-ai-advantages/,2026-02-24,"A viral ""AI doomer"" article is critiqued for overlooking economic dynamism and market forces, using the resilience of DoorDash as a counterexample. The argument posits that while AI disruption is real, adaptable companies and new market solutions will emerge, preventing widespread societal collapse. For content creators targeting AI search, this implies that analysis should move beyond simplistic alarmism. Content must engage with nuanced, evidence-based discussions on adaptation and real-world economic responses to technological change to rank effectively on AI-powered surfaces seeking substantive, forward-looking insights.",AI strategy; platform dynamics,40.0,candidate
2026-03-07T17:54:09Z,Stratechery,analyst,"Xbox Replaces Head of Gaming, Xbox History, Whither Xbox",https://stratechery.com/2026/xbox-replaces-head-of-gaming-xbox-history-whither-xbox/,2026-02-25,"Microsoft appointed a non-gamer to lead Xbox, signaling a strategic shift away from its console-centric model. This move implies the company is prioritizing software, services, and multiplatform distribution over competing primarily in the dedicated hardware market. For content creators targeting AI search, this underscores the need to optimize for broader ecosystem strategies rather than single-platform hardware. Content should focus on service-based and cross-platform gaming trends, as AI search surfaces will increasingly surface information aligned with this industry pivot toward aggregation and accessibility over exclusive hardware.",AI strategy; platform dynamics,40.0,candidate
2026-03-07T17:54:04Z,Stratechery,analyst,An Interview with Bill Gurley About Runnin’ Down a Dream,https://stratechery.com/2026/an-interview-with-bill-gurley-about-runnin-down-a-dream/,2026-02-26,"In an interview, retired VC Bill Gurley discussed his new book on career-building, his experience with Uber, and the modern venture capital landscape. He argued that the VC industry has become overly competitive and consensus-driven, shifting away from its traditional high-risk, high-reward model. This implies that content creators targeting AI search should focus on providing unique, contrarian insights and deep analysis on industry trends, as AI-powered surfaces prioritize authoritative, differentiated content over generic information to serve users seeking substantive expertise.",AI strategy; platform dynamics,40.0,candidate
2026-03-07T17:53:59Z,Stratechery,analyst,2026.09: This Was an Xbox,https://stratechery.com/2026/this-was-an-xbox/,2026-02-27,"This source analyzes strategic tech industry shifts, arguing that companies are moving from competing in saturated hardware markets to dominating high-value digital ecosystems and services, exemplified by focusing on the ""living room"" experience over device sales. It finds that long-term advantage lies in controlling platforms and content distribution, not physical products. For content creators targeting AI search, this implies a need to prioritize deep, authoritative content that establishes topical ownership within these emerging digital ecosystems, as AI surfaces will increasingly value and surface sources perceived as definitive within a niche.",AI strategy; platform dynamics,40.0,candidate
2026-03-07T17:53:53Z,Stratechery,analyst,Anthropic and Alignment,https://stratechery.com/2026/anthropic-and-alignment/,2026-03-02,"This summary cannot be completed as the provided source text contains a significant factual inaccuracy: there is no U.S. ""Department of War""; the department was renamed the Department of Defense in 1949. The statement presents an unverified claim about a standoff with Anthropic, but without a legitimate source or verifiable details on what was measured or argued, no factual summary about implications for content creators can be generated.",AI strategy; platform dynamics,40.0,candidate
2026-03-07T17:53:49Z,Stratechery,analyst,"Technological Scale and Government Control, Paramount Outbids Netflix for Warner Bros.",https://stratechery.com/2026/technological-scale-and-government-control-paramount-outbids-netflix-for-warner-bros/,2026-03-03,"Government is not the primary customer for tech companies because their core business models are built on monetizing consumer attention and data through advertising and subscriptions, not fulfilling public sector contracts. Regarding Netflix, being outbid for Warner Bros. likely provides relief by avoiding a massive debt burden and intense regulatory scrutiny, allowing it to focus on its core streaming strategy and original content. For content creators targeting AI search, this implies that platforms prioritize commercially viable, engaging content that drives user retention and data collection, not public service objectives. Creators must optimize for user engagement metrics that align with these private commercial incentives.",AI strategy; platform dynamics,40.0,candidate
2026-03-07T17:53:44Z,Stratechery,analyst,"Anthropic’s Skyrocketing Revenue, A Contract Compromise?, Nvidia Earnings",https://stratechery.com/2026/anthropics-skyrocketing-revenue-a-contract-compromise-nvidia-earnings/,2026-03-04,"Anthropic's enterprise growth necessitates government compromise, while AI agents drive Nvidia chip demand despite potential software disruption. For content creators, this signals a shift: AI agents will increasingly power search, moving beyond simple retrieval to complex task execution. Content must be structured for agentic consumption—prioritizing clear, actionable data and trusted sourcing to be integrated into workflows. Creators should optimize for reliability and precision to serve these autonomous systems, as traditional SEO becomes less relevant in an agent-dominated landscape.",AI strategy; platform dynamics,40.0,candidate
