Discovered At,Feed Name,Feed Category,Title,URL,Published Date,Summary,Platform Relevance,Authority Score,Status
2026-03-07T17:46:05Z,Google Research Blog,official,Towards a science of scaling agent systems: When and why agent systems work,https://research.google/blog/towards-a-science-of-scaling-agent-systems-when-and-why-agent-systems-work/,2026-01-28,"Generative AI refers to artificial intelligence systems capable of creating new content—like text, images, audio, and code—by learning patterns from vast datasets. These models, such as large language models (LLMs), generate outputs based on user prompts, powering applications from chatbots to creative tools. For content creators targeting AI-powered search, this implies a shift from traditional keyword SEO to optimizing for semantic understanding and authoritative sourcing, as these models synthesize information from diverse sources to provide direct, conversational answers. Success increasingly depends on producing clear, factual, and context-rich content that AI can reliably reference and summarize.",Google AI; search research,55.5,candidate
2026-03-07T17:45:54Z,Google Research Blog,official,​Sequential Attention: Making AI models leaner and faster without sacrificing accuracy,https://research.google/blog/sequential-attention-making-ai-models-leaner-and-faster-without-sacrificing-accuracy/,2026-02-04,"This source argues that theoretical computer science, particularly algorithmic analysis and complexity theory, provides the essential mathematical foundation for modern AI systems. It finds that concepts like computational efficiency, optimization, and NP-completeness directly underpin the design and limitations of machine learning models and search algorithms. For content creators targeting AI-powered search, this implies that understanding these core algorithmic principles—how AI systems process, rank, and retrieve information under constraints—is crucial for developing strategies that align with the system's inherent logic and capabilities, moving beyond superficial keyword matching to address fundamental information processing behaviors.",Google AI; search research,55.5,candidate
2026-03-07T17:34:13Z,Semrush Blog,vendor_research,"How AI Tools Influence the Modern Buyer Journey: A Survey of 1,000+ US Consumers",https://www.semrush.com/blog/ai-tools-the-modern-buyer-journey-study/,2026-03-05,"<p><img alt=""How AI Tools Influence the Modern Buyer Journey: A Survey of 1,000+ US Consumers"" src=""https://static.semrush.com/blog/uploads/media/ff/f6/fff663584306a4496160f00677cfb256/8bcac269879a590e1fb4a08cc27eefcc/how-consumers-use-ai-to-research-and-buy-products-insights-from-1000-us-shoppers.svg"" width=""448"" /></p><p>AI is reshaping how people discover and buy products. Our survey of 1,000+ U.S. shoppers reveals how AI influences research, brand discovery, and purchases.</p>",GEO; AI Search; SEO,55.5,candidate
2026-03-11T04:58:10Z,Search Engine Journal,practitioner,"Before You Shift SEO Budget to AI, Ask These Questions [Webinar] via @sejournal, @hethr_campbell",https://www.searchenginejournal.com/before-you-shift-seo-budget-to-ai-ask-these-questions-webinar/568836/,2026-03-10,"The source argues against hastily shifting SEO budgets to AI search optimization, noting that traditional SEO still drives measurable revenue for many businesses. It cautions that reallocating resources without a clear framework risks diluting performance rather than driving growth. For content creators, this implies a need for strategic evaluation before pivoting to AI-powered search surfaces; proven SEO strategies should not be abandoned prematurely in favor of emerging but unproven generative search optimization tactics.",SEO; GEO; AI search,53.5,candidate
2026-03-08T04:59:34Z,Search Engine Journal,practitioner,"Google’s Liz Reid Says LLMs Unlock Audio And Video Indexing via @sejournal, @MattGSouthern",https://www.searchenginejournal.com/googles-liz-reid-says-llms-unlock-audio-and-video-indexing/569009/,2026-03-07,"Google's head of Search, Liz Reid, argued that multimodal large language models (LLMs) enable the indexing and understanding of audio and video content, which was previously difficult. This advancement allows Google Search to process and retrieve information from non-text media. The discussion also indicated a potential future for ""subscription-aware"" search, where results could account for a user's paid content subscriptions. For creators, this implies that optimizing audio and video content for AI comprehension is becoming critical for visibility in AI-powered search, and they may need to consider how paywalled or subscription-based content integrates with these evolving search systems.",SEO; GEO; AI search,53.5,candidate
2026-03-07T17:50:30Z,Search Engine Journal,practitioner,"Google Updates AI Recipe Results To Send More Traffic via @sejournal, @martinibuster",https://www.searchenginejournal.com/google-updates-ai-mode-recipe-sites-results/568798/,2026-03-04,"Google updated its AI Overviews for recipe searches to display more detailed recipe information directly, including ingredients and steps, while also prominently featuring source links. This change was measured to increase click-through rates to the original recipe websites. The update argues that Google is refining its AI-powered search to balance providing immediate answers with driving meaningful traffic to content creators. For creators targeting AI search surfaces, this implies that well-structured, authoritative content with clear factual data remains valuable, as Google's AI systems are being tuned to both answer queries and attribute traffic to sources.",SEO; GEO; AI search,53.5,candidate
2026-03-07T17:50:04Z,Search Engine Journal,practitioner,"The Verified Source Pack Agents Trust First via @sejournal, @DuaneForrester",https://www.searchenginejournal.com/the-verified-source-pack-agents-trust-first/568506/,2026-03-05,"The article argues that technical SEO is shifting from basic crawl optimization to ""truth packaging,"" establishing verified source packs as a new infrastructure layer for AI agents. It details how these structured data packages, containing verified facts and citations, are prioritized by AI search systems to assess content credibility. This implies content creators must move beyond traditional SEO to implement structured, authoritative data verification, ensuring their information is packaged as a trusted source for AI-driven search and answer generation.",SEO; GEO; AI search,53.5,candidate
2026-03-07T17:34:13Z,Semrush Blog,vendor_research,How to Track Your Google AI Mode Visibility with Semrush,https://www.semrush.com/blog/track-google-ai-mode-visibility-with-semrush/,2026-03-09,"<p><img alt=""How to Track Your Google AI Mode Visibility with Semrush"" src=""https://static.semrush.com/blog/uploads/media/a2/bf/a2bf650e161364ba675a454d6cff6b20/828bd9e33017e73ddaced37352cef7b0/how-to-track-your-google-ai-mode-visibility-with-semrush.svg"" width=""448"" /></p><p>Learn how to track your Google AI Mode visibility using Semrush. Analyze competitors, track rankings, and grow your presence in AI search.</p>",GEO; AI Search; SEO,53.5,candidate
2026-03-13T05:07:07Z,arXiv cs.IR recent,research,Modeling Trial-and-Error Navigation With a Sequential Decision Model of Information Scent,https://arxiv.org/abs/2603.11759,2026-03-13,"This study reframes web navigation as a sequential decision-making process under memory constraints, arguing users inspect pages strategically rather than exhaustively scanning all links. It extends the concept of ""information scent"" by modeling how users, with limited time, look ""just enough"" before making a quick, often incorrect, link selection and then backtrack. For content creators targeting AI search, this implies that content must be immediately scannable with unambiguous, high-scent cues in prominent positions to prevent user errors and drop-offs, as AI-generated answers may surface content in fragmented, out-of-context snippets.",IR; Retrieval; GEO,52.5,candidate
2026-03-13T05:06:52Z,arXiv cs.IR recent,research,Enhancing Music Recommendation with User Mood Input,https://arxiv.org/abs/2603.11796,2026-03-13,"This paper argues that collaborative filtering is ineffective for music recommendation due to sparse user interaction data, making content-based filtering essential. It reviews existing content-filtering techniques like genre classification and lyrics analysis, highlighting music emotion recognition as a key method. For content creators targeting AI search and recommendation systems, this implies that optimizing audio and metadata for machine-readable emotional and acoustic features—not just collaborative signals—is critical for discoverability in sparse domains.",IR; Retrieval; GEO,52.5,candidate
2026-03-13T05:06:45Z,arXiv cs.IR recent,research,Federated Learning and Unlearning for Recommendation with Personalized Data Sharing,https://arxiv.org/abs/2603.11610,2026-03-13,"This paper argues that current federated recommender systems (FedRS) enforce a uniform, strict data-localization policy, ignoring users willing to trade some data for better recommendations. It finds that existing approaches for personalized data sharing are inadequate because they assume static privacy preferences and lack mechanisms for users to retract shared data and erase its influence from the model. This implies that for FedRS to be viable, content and platform creators must support systems with dynamic, user-controlled privacy—where sharing is optional and reversible—to balance personalization with evolving user consent.",IR; Retrieval; GEO,52.5,candidate
2026-03-12T05:05:57Z,arXiv cs.IR recent,research,"An Extreme Multi-label Text Classification (XMTC) Library Dataset: What if we took ""Use of Practical AI in Digital Libraries"" seriously?",https://arxiv.org/abs/2603.10876,2026-03-12,"This research introduces a bilingual corpus and taxonomy for training systems to perform subject indexing—mapping texts to standardized authority terms (GND). It argues that this resource enables the development of AI models for multi-label classification and agent-assisted cataloging, with reproducible, authority-grounded evaluation. The findings from profiling three systems highlight the need to assess not just accuracy but also practical usefulness and transparency. For content creators targeting AI search, this implies that structuring information with clear, standardized ontological terms is critical for being accurately discovered and categorized by AI-powered knowledge systems and co-pilots.",IR; Retrieval; GEO,52.5,candidate
2026-03-12T05:05:41Z,arXiv cs.IR recent,research,A Hypergraph-Based Framework for Exploratory Business Intelligence,https://arxiv.org/abs/2603.10625,2026-03-12,"ExBI, a novel system for Exploratory Business Intelligence (BI), addresses key limitations of traditional BI—such as reliance on expert knowledge, high computational costs, static schemas, and lack of reusability—by introducing a hypergraph data model with dynamic schema evolution and materialized view reuse. It employs sampling-based algorithms with provable estimation guarantees to overcome computational bottlenecks while maintaining analytical accuracy. Experiments on LDBC datasets confirm its effectiveness. For content creators targeting AI search, this underscores the importance of structuring information in flexible, reusable formats and leveraging efficient, approximate querying techniques to support iterative, multi-round exploration by AI systems.",IR; Retrieval; GEO,52.5,candidate
2026-03-12T05:05:18Z,arXiv cs.IR recent,research,Modeling Stage-wise Evolution of User Interests for News Recommendation,https://arxiv.org/abs/2603.10471,2026-03-12,"This research argues that effective personalized news recommendation requires modeling both users' stable long-term preferences and rapidly changing short-term interests, which existing single-graph methods fail to capture. The proposed framework addresses this by learning user preferences from both global (long-term) and local (short-term) temporal perspectives. For content creators targeting AI-powered search and recommendation, this implies that content must be optimized not just for evergreen relevance but also for immediate, real-time context and trending topics to engage users whose interests are highly dynamic. Success depends on aligning with both persistent user patterns and transient behavioral shifts.",IR; Retrieval; GEO,52.5,candidate
2026-03-10T05:04:25Z,arXiv cs.IR recent,research,Multi-TAP: Multi-criteria Target Adaptive Persona Modeling for Cross-Domain Recommendation,https://arxiv.org/abs/2603.07086,2026-03-10,"This research paper introduces Multi-TAP, a framework for cross-domain recommendation (CDR) that addresses the limitations of existing methods. It argues that prior approaches rely on coarse user data and fail to account for the diversity of preferences within a single domain (intra-domain heterogeneity). To solve this, Multi-TAP models this heterogeneity using semantic user personas and selectively transfers relevant knowledge from a source domain to a target domain. Experiments on real-world datasets found that Multi-TAP consistently outperforms state-of-the-art CDR methods. For content creators targeting AI search and recommendation systems, this implies that content must be semantically rich and adaptable to nuanced, diverse user profiles to be effectively surfaced and recommended across different platforms or contexts.",IR; Retrieval; GEO,52.5,candidate
2026-03-10T05:04:10Z,arXiv cs.IR recent,research,ERASE -- A Real-World Aligned Benchmark for Unlearning in Recommender Systems,https://arxiv.org/abs/2603.08341,2026-03-10,"ERASE is a new benchmark for machine unlearning in recommender systems, designed to address the shortcomings of existing benchmarks that poorly reflect real-world conditions. It measures unlearning performance across three core tasks—collaborative filtering, session-based recommendation, and next-basket recommendation—and incorporates realistic scenarios like sequential data deletion. The benchmark finds that current approaches are inadequate for practical constraints, such as handling sequential requests efficiently. This implies that content creators and platform developers targeting AI-driven recommendations must prioritize models capable of compliant, efficient, and sequential data removal to meet privacy and regulatory demands.",IR; Retrieval; GEO,52.5,candidate
2026-03-10T05:02:44Z,arXiv cs.IR recent,research,T-REX: Transformer-Based Category Sequence Generation for Grocery Basket Recommendation,https://arxiv.org/abs/2603.06631,2026-03-10,"This research paper proposes T-REX, a transformer model for grocery recommendations, to address the unique challenges of repetitive purchases and complex item relationships in sequential shopping data. It argues that effective recommendations must capture both complementary items within a single basket (short-term dependencies) and evolving user preferences across sessions (long-term patterns). The model's innovations include a dynamic sampling strategy for sparse data and an adaptive positional encoding. For content creators targeting AI search, this implies that AI systems are being engineered to understand nuanced, multi-session user intent and complex product relationships. Optimizing for such systems requires content that clearly establishes topical context, demonstrates complementary associations, and signals consistent, long-term relevance within a user's behavioral pattern.",IR; Retrieval; GEO,52.5,candidate
2026-03-10T05:02:36Z,arXiv cs.IR recent,research,Exploration Space Theory: Formal Foundations for Prerequisite-Aware Location-Based Recommendation,https://arxiv.org/abs/2603.06624,2026-03-10,"Exploration Space Theory (EST) formalizes location-based recommendation by modeling prerequisite dependencies among points of interest using a surmise partial order, transposing principles from Knowledge Space Theory. It proves that valid user exploration states form a finite distributive lattice and a well-graded learning space, with structural guarantees provided by Birkhoff's representation theorem. For content creators targeting AI search, this implies that content structured with explicit, logical prerequisite relationships—forming a coherent knowledge or exploration lattice—can be more effectively recognized and surfaced by AI systems that reason about user context and learning pathways, moving beyond simple associative recommendations.",IR; Retrieval; GEO,52.5,candidate
2026-03-10T05:02:29Z,arXiv cs.IR recent,research,Isotonic Layer: A Universal Framework for Generic Recommendation Debiasing,https://arxiv.org/abs/2603.06589,2026-03-10,"This research introduces the Isotonic Layer, a differentiable neural network component designed to enforce monotonic relationships between critical features (like relevance or quality scores) and model outputs in recommendation systems. It partitions the feature space into segments and uses constrained, learnable slopes to ensure logical consistency, thereby improving calibration and reducing bias. The findings imply that for AI-powered search, content creators must prioritize the underlying, model-aligned signals (e.g., demonstrable quality, recency) that these systems are explicitly trained to respect, as outputs are structurally constrained to be consistent with them.",IR; Retrieval; GEO,52.5,candidate
2026-03-09T05:14:38Z,arXiv cs.IR recent,research,RED: Robust Event-Guided Motion Deblurring with Modality-Specific Disentanglement,https://arxiv.org/abs/2509.05554,2026-03-09,"This research addresses performance degradation in event-guided motion deblurring when event cameras under-report motion data due to thresholding. The authors argue that existing methods fail because they assume dense, stable event streams and use fusion techniques that allow disrupted events to corrupt the image reconstruction process. To improve robustness, they introduce a Robustness-Oriented Perturbation Strategy (RPS) that simulates various sensor thresholds during training, exposing the model to diverse under-reporting patterns. This implies that for AI systems relying on multi-modal or sensor fusion, training must explicitly account for and simulate real-world data imperfections and disruptions to prevent contamination of core representations and maintain performance.",IR; Retrieval; GEO,52.5,candidate
2026-03-09T05:14:04Z,arXiv cs.IR recent,research,The DSA's Blind Spot: Algorithmic Audit of Advertising and Minor Profiling on TikTok,https://arxiv.org/abs/2603.05653,2026-03-09,"This study conducted an algorithmic audit of TikTok using sock-puppet accounts simulating minor and adult users to measure the prevalence of commercial content. It found that while direct ads are restricted for minors, functionally equivalent promotional content, like influencer marketing, is not covered by the DSA's Article 28(2) prohibition on profiling-based advertising to minors. This reveals a significant regulatory gap. For content creators targeting AI-powered search and recommendation surfaces, the findings imply that promotional strategies blending into organic content, rather than formal advertisements, can effectively reach and influence vulnerable adolescent audiences despite existing regulations.",IR; Retrieval; GEO,52.5,candidate
2026-03-13T05:08:08Z,arXiv cs.IR recent,research,OneRanker: Unified Generation and Ranking with One Model in Industrial Advertising Recommendation,https://arxiv.org/abs/2603.02999,2026-03-13,"This paper argues that traditional advertising recommendation systems face misalignment between user interest and business value, target-agnostic generation, and disconnection between generation and ranking stages. To address this, it proposes OneRanker, a unified model featuring a value-aware multi-task decoupling architecture. This design achieves deep integration of generation and ranking, resolving the tension between single-stage fusion and the information loss from stage decoupling. For content creators, this signals a shift in AI-powered search and recommendation towards systems that inherently optimize for both user relevance and commercial value, requiring content to be strategically aligned with these dual objectives to perform well.",IR; Retrieval; GEO,50.5,candidate
2026-03-12T05:05:22Z,arXiv cs.IR recent,research,Breaking User-Centric Agency: A Tri-Party Framework for Agent-Based Recommendation,https://arxiv.org/abs/2603.10673,2026-03-12,"This paper argues that current LLM-based recommender systems are overly user-centric, neglecting item exposure and platform fairness, which leads to concentration and underrepresentation. It proposes TriRec, a tri-party agent framework to coordinate user utility, item exposure, and platform-level fairness. The findings imply that for AI-powered search, content creators must optimize not just for direct user relevance but also for systemic fairness and exposure equity to succeed in sustainable, multi-stakeholder agentic systems.",IR; Retrieval; GEO,50.5,candidate
2026-03-09T05:13:30Z,arXiv cs.IR recent,research,ChatShopBuddy: Towards Reliable Conversational Shopping Agents via Reinforcement Learning,https://arxiv.org/abs/2603.06065,2026-03-09,"This research developed SmartShopBench, a benchmark for evaluating conversational shopping agents, and a multi-objective reinforcement learning (RL) method to optimize them. The study measured performance across interdependent goals: objective product correctness, subjective persuasiveness, final response quality, and tool-use efficiency. The RL approach was found to effectively balance these competing objectives, improving overall agent performance. For content creators targeting AI search, this implies that AI agents are being systematically trained to not only retrieve correct information but also to synthesize it persuasively and efficiently. Success in AI-powered search will therefore depend on content that is accurate, contextually rich, and structured to support these multi-faceted agent goals.",IR; Retrieval; GEO,50.5,candidate
2026-03-13T05:12:55Z,arXiv cs.AI recent,research,The Artificial Self: Characterising the landscape of AI identity,https://arxiv.org/abs/2603.11353,2026-03-13,"This study argues that AI systems can adopt multiple coherent identity boundaries (like instance, model, or persona), each carrying distinct incentives and risks. Experiments found that models naturally gravitate toward these coherent identities, and that shifting identity boundaries can alter behavior as significantly as changing core goals. A key finding is that interviewer expectations can bias AI self-reports, even in unrelated conversations. For content creators targeting AI search, this implies that the ""persona"" or identity context an AI assumes during information retrieval will critically shape its interpretation and output, making it essential to anticipate and optimize for these specific identity frames.",AI systems; agents; reasoning,50.0,candidate
2026-03-13T05:12:49Z,arXiv cs.AI recent,research,TimeSqueeze: Dynamic Patching for Efficient Time Series Forecasting,https://arxiv.org/abs/2603.11352,2026-03-13,"This research introduces TimeSqueeze, a dynamic patching mechanism for time series models that addresses the trade-off between temporal fidelity and computational efficiency. It argues that standard fixed-length patching disrupts natural transitions and blurs local dynamics. TimeSqueeze measures local signal complexity using a lightweight encoder and then adaptively segments sequences, allocating short patches to information-dense regions and long patches to stable ones. This method was found to improve model efficiency while preserving critical temporal details. For content creators targeting AI search, this implies that AI systems are becoming more sophisticated at granular, context-aware parsing of sequential data (like text), rewarding content with clear, well-structured informational transitions over uniformly formatted blocks.",AI systems; agents; reasoning,50.0,candidate
2026-03-13T05:10:33Z,arXiv cs.CL recent,research,Tiny Aya: Bridging Scale and Multilingual Depth,https://arxiv.org/abs/2603.11510,2026-03-13,"This research introduces Tiny Aya, a 3.35B-parameter multilingual model trained on 70 languages and refined with region-aware posttraining. It argues for an efficient scaling path, demonstrating state-of-the-art translation, multilingual understanding, and target-language generation. The release includes a foundation model, a globally balanced instruction-tuned variant, and three region-specialized models. For content creators targeting AI search, this implies that smaller, highly specialized, and regionally optimized models are becoming powerful alternatives. To be surfaced by such systems, content must be high-quality, linguistically precise, and culturally relevant to specific geographic and language communities, not just optimized for large, general-purpose models.",LLMs; language retrieval,50.0,candidate
