Discovered At,Feed Name,Feed Category,Title,URL,Published Date,Summary,Platform Relevance,Authority Score,Status
2026-03-13T05:08:01Z,arXiv cs.IR recent,research,Geodesic Semantic Search: Learning Local Riemannian Metrics for Citation Graph Retrieval,https://arxiv.org/abs/2602.23665,2026-03-13,"Geodesic Semantic Search (GSS) is a retrieval system that learns local Riemannian metrics on citation graphs to enable geometry-aware semantic search, moving beyond fixed Euclidean distances. It parameterizes a low-rank metric tensor at each node to guarantee valid metrics. Evaluated on citation prediction benchmarks with 169K papers, GSS achieves a 23% relative improvement in retrieval performance. This implies that for AI search, content creators should consider how their work is contextually embedded within relational networks like citation graphs, as advanced retrieval systems increasingly use such geometric and relational structures to determine relevance, not just isolated semantic similarity.",IR; Retrieval; GEO,84.5,candidate
2026-03-12T05:05:13Z,arXiv cs.IR recent,research,Differentiable Geometric Indexing for End-to-End Generative Retrieval,https://arxiv.org/abs/2603.10409,2026-03-12,"This paper identifies two core conflicts in Generative Retrieval (GR) systems: an Optimization Blockage from non-differentiable indexing and a Geometric Conflict where standard objectives cause norm inflation, allowing popular items to overshadow relevant long-tail content. To resolve these, the authors propose Differentiable Geometric Indexing (DGI). For content creators, this implies that AI search systems are actively moving beyond simple keyword matching toward unified probabilistic frameworks. Success will increasingly depend on a content's intrinsic relevance within these learned geometric and differentiable structures, not just its popularity or surface-level keyword density.",IR; Retrieval; GEO,84.5,candidate
2026-03-13T05:08:28Z,arXiv cs.IR recent,research,TURA: Tool-Augmented Unified Retrieval Agent for AI Search,https://arxiv.org/abs/2508.04604,2026-03-13,"This paper argues that the current RAG-based AI search paradigm is limited by its reliance on static web content, failing to address dynamic, real-time queries (e.g., ticket availability). It introduces a framework to integrate dynamic sources like databases and APIs directly into the retrieval process. The findings imply that content creators must prioritize exposing structured, real-time data through APIs or database endpoints, as future AI search will increasingly bypass static pages to fetch live information directly, fundamentally shifting SEO strategies.",IR; Retrieval; GEO,76.5,candidate
2026-03-13T05:08:22Z,arXiv cs.IR recent,research,Seq vs Seq: An Open Suite of Paired Encoders and Decoders,https://arxiv.org/abs/2507.11412,2026-03-13,"This research introduces the Ettin model suite, which provides a direct comparison between encoder-only and decoder-only LLM architectures by training paired models with identical parameters, data, and methods. It finds that while decoder-only models dominate generative tasks, encoder-only models remain highly effective for classification and retrieval. For content creators targeting AI search, this implies that optimizing for retrieval (via encoder models that power many search backends) is as crucial as optimizing for generative answer synthesis, requiring content that is both factually dense for retrieval and well-structured for answer generation.",IR; Retrieval; GEO,76.5,candidate
2026-03-12T05:05:46Z,arXiv cs.IR recent,research,RAGPerf: An End-to-End Benchmarking Framework for Retrieval-Augmented Generation Systems,https://arxiv.org/abs/2603.10765,2026-03-12,"RAGPerf is a benchmarking framework designed to measure and analyze the performance of modular RAG (Retrieval-Augmented Generation) AI systems. It decouples the workflow into components like embedding, retrieval, and generation, allowing users to configure parameters and assess their impact on end-to-end query performance and quality. The framework includes a workload generator to model real-world scenarios using diverse data types and query patterns. For content creators targeting AI search, this implies that optimizing for RAG systems requires a granular, component-aware strategy, as performance and final output quality are highly sensitive to the configuration of each pipeline stage.",IR; Retrieval; GEO,76.5,candidate
2026-03-12T05:05:26Z,arXiv cs.IR recent,research,Structured Linked Data as a Memory Layer for Agent-Orchestrated Retrieval,https://arxiv.org/abs/2603.10700,2026-03-12,"This study measured whether structured linked data (Schema.org markup and entity pages) improves retrieval and answer quality in standard and agentic RAG systems across four domains. It tested seven document representation conditions, including plain HTML, HTML with JSON-LD, and a Linked Data Platform. The research found that structured data significantly enhanced retrieval accuracy and answer quality, particularly for agentic systems performing complex reasoning. This implies that content creators targeting AI search must implement structured data markup to ensure their content is accurately retrieved and effectively utilized by increasingly sophisticated AI agents.",IR; Retrieval; GEO,76.5,candidate
2026-03-12T05:05:03Z,arXiv cs.IR recent,research,Does Reasoning Make Search More Fair? Comparing Fairness in Reasoning and Non-Reasoning Rerankers,https://arxiv.org/abs/2603.10332,2026-03-12,"This study systematically compared the fairness of reasoning and non-reasoning rerankers using the TREC 2022 Fair Ranking Track dataset. It measured six models across multiple retrieval settings and demographic attributes, finding that reasoning-based reranking neither improves nor harms fairness compared to non-reasoning approaches. The fairness metric, Attention-Weighted Rank Fairness (AWRF), remained stable (0.33-0.35) across all models, even as relevance metrics like nDCG varied substantially (0.247-1.000). This implies that for content creators targeting AI search, optimizing for relevance via advanced rerankers does not inherently compromise or enhance fairness in result exposure, allowing a focus on relevance without fairness trade-offs in these systems.",IR; Retrieval; GEO,76.5,candidate
2026-03-11T05:00:29Z,arXiv cs.IR recent,research,PathoScribe: Transforming Pathology Data into a Living Library with a Unified LLM-Driven Framework for Semantic Retrieval and Clinical Integration,https://arxiv.org/abs/2603.08935,2026-03-11,"PathoScribe is a retrieval-augmented LLM framework designed to unlock the diagnostic value of narrative pathology reports. It argues that simply digitizing these archives is insufficient; the key is enabling real-time retrieval and reasoning over prior similar cases. The system was developed to allow pathologists to interrogate this knowledge during new diagnostic evaluations. For content creators targeting AI search, this implies a critical shift: optimizing for static keyword indexing is inadequate. Success requires structuring and presenting information so AI systems can dynamically retrieve and synthesize it to answer complex, context-specific queries, moving beyond simple lookup to active reasoning.",IR; Retrieval; GEO,76.5,candidate
2026-03-11T05:00:25Z,arXiv cs.IR recent,research,Interpretable Markov-Based Spatiotemporal Risk Surfaces for Missing-Child Search Planning with Reinforcement Learning and LLM-Based Quality Assurance,https://arxiv.org/abs/2603.08933,2026-03-11,"Guardian is a decision-support system designed to aid missing-child investigations by converting unstructured case data into a structured spatiotemporal format and enriching it with geocoding and transportation context. Its predictive component features a three-layer model: a Markov chain for predicting the child's location, a second layer incorporating demographic and environmental factors, and a third layer that fuses these predictions with real-time search data to generate probabilistic search maps for the critical first 72 hours. For content creators targeting AI search, this underscores the necessity of structuring information in a machine-readable, schema-aligned format and integrating multi-layered, contextual data to produce actionable, predictive outputs for specialized domains.",IR; Retrieval; GEO,76.5,candidate
2026-03-11T05:00:20Z,arXiv cs.IR recent,research,Quantifying Uncertainty in AI Visibility: A Statistical Framework for Generative Search Measurement,https://arxiv.org/abs/2603.08924,2026-03-11,"This study measured citation variability across Perplexity, OpenAI SearchGPT, and Google Gemini, arguing that visibility metrics are stochastic estimators, not fixed values. It found significant variability in cited sources and their rankings across repeated identical queries. This implies content creators must optimize for repeated sampling, not single-run results, requiring strategies that ensure consistent citation across the non-deterministic distribution of AI-generated answers.",IR; Retrieval; GEO,76.5,candidate
2026-03-11T05:00:05Z,arXiv cs.IR recent,research,MITRA: An AI Assistant for Knowledge Retrieval in Physics Collaborations,https://arxiv.org/abs/2603.09800,2026-03-11,"This research developed MITRA, a RAG-based system for answering physics analysis questions within large scientific collaborations like CMS at CERN. It measured the system's ability to navigate vast, complex internal documentation using an automated pipeline for document retrieval and high-fidelity text extraction via OCR and layout parsing. The prototype demonstrates that structured, context-aware retrieval from specialized corpora is crucial for accurate AI-generated answers. For content creators targeting AI search, this implies that ensuring content is machine-readable, well-structured, and rich in specific contextual detail is essential for effective indexing and retrieval by AI systems in technical domains.",IR; Retrieval; GEO,76.5,candidate
2026-03-11T04:59:57Z,arXiv cs.IR recent,research,Diagnosing and Repairing Citation Failures in Generative Engine Optimization,https://arxiv.org/abs/2603.09296,2026-03-11,"This paper argues that existing Generative Engine Optimization (GEO) methods are flawed because they measure a document's general influence on an AI response rather than its actual citation, which is what drives creator traffic. It also criticizes their use of uniform rewriting rules. To address this, the authors propose a diagnostic framework featuring a taxonomy of citation failure modes and an agentic system, AgentGEO, that identifies specific reasons a document is not cited and applies targeted interventions. The implication is that content creators must move beyond generic SEO tactics and instead systematically diagnose and fix specific, pipeline-stage failures to secure citations in AI-generated answers.",IR; Retrieval; GEO,76.5,candidate
2026-03-10T05:02:58Z,arXiv cs.IR recent,research,Leveraging Large Language Models for Automated Scalable Development of Open Scientific Databases,https://arxiv.org/abs/2603.07050,2026-03-10,"This paper introduces a web-based tool that automates the construction of domain-specific scientific databases. It argues that manual data collection from online literature is inefficient and error-prone. The proposed solution is a unified framework combining keyword queries, API data retrieval, and LLM-powered text classification to scalably identify and filter relevant scientific data. For content creators targeting AI search, this demonstrates a growing trend where AI agents use structured workflows—combining search, retrieval, and LLM analysis—to source authoritative information. It implies that to be surfaced by such tools, content must be technically accessible via APIs, clearly relevant to specific keyword queries, and structured in a way that facilitates reliable machine classification and extraction.",IR; Retrieval; GEO,76.5,candidate
2026-03-09T05:13:57Z,arXiv cs.IR recent,research,VDCook:DIY video data cook your MLLMs,https://arxiv.org/abs/2603.05539,2026-03-09,"VDCook is a self-evolving video data platform that allows users to generate domain-specific video datasets through natural language queries. It operates by automatically optimizing these queries and concurrently executing real video retrieval and controlled AI synthesis based on user-defined parameters like scale and quality. The system outputs complete data packages with full provenance and reproducible code. For content creators targeting AI search, this signifies a shift where AI systems can autonomously generate or synthesize training data on-demand. This implies that to remain relevant as a data source, creator content must be highly authentic, unique, and verifiable to be prioritized over synthetic alternatives in retrieval processes.",IR; Retrieval; GEO,76.5,candidate
2026-03-09T05:13:43Z,arXiv cs.IR recent,research,"Efficient, Property-Aligned Fan-Out Retrieval via RL-Compiled Diffusion",https://arxiv.org/abs/2603.06397,2026-03-09,"This paper argues that set-valued retrieval objectives like diversity and coverage are not captured by standard top-1 datasets, making fan-out retrieval (generating diverse subqueries) necessary. It finds that while reinforcement learning (RL) can optimize these set-level goals, deploying an RL-tuned LLM for this is too computationally expensive at inference. The implication is that content creators must optimize for being selected within these diverse, multi-faceted result sets generated by AI systems, not just for a single top ranking, as search engines prioritize comprehensive collections over individual relevance.",IR; Retrieval; GEO,76.5,candidate
2026-03-09T05:13:22Z,arXiv cs.IR recent,research,Sensitivity-Aware Retrieval-Augmented Intent Clarification,https://arxiv.org/abs/2603.06025,2026-03-09,"This study argues that retrieval-augmented intent clarification, which enhances conversational search by integrating external data retrieval, significantly improves performance in domains where LLMs lack parametric knowledge. However, it finds this approach introduces a critical risk in sensitive domains like healthcare or legal contexts, as the retrieval database may contain confidential information. This implies that content creators targeting AI search surfaces must prioritize data security and access controls, especially when their content feeds these retrieval systems, to prevent the unintended exposure of sensitive information in search clarifications.",IR; Retrieval; GEO,76.5,candidate
2026-03-09T05:13:09Z,arXiv cs.IR recent,research,CBR-to-SQL: Rethinking Retrieval-based Text-to-SQL using Case-based Reasoning in the Healthcare Domain,https://arxiv.org/abs/2603.05569,2026-03-09,"This research argues that standard Retrieval-Augmented Generation (RAG) is insufficient for translating medical questions to SQL from EHRs due to domain-specific jargon and noise. The proposed CBR-to-SQL framework replaces static example pools with a dynamic, multi-step retrieval process inspired by Case-Based Reasoning. It was found to improve accuracy by retrieving and adapting the most relevant past SQL cases. For content creators targeting AI search, this implies that optimizing for single-step keyword retrieval is inadequate; systems are evolving towards complex, context-aware reasoning that chains multiple pieces of evidence, requiring content structured to support such multi-faceted, analogical querying.",IR; Retrieval; GEO,76.5,candidate
2026-03-07T17:34:12Z,OpenAI News,official,Introducing ChatGPT for Excel and new financial data integrations,https://openai.com/index/chatgpt-for-excel,2026-03-05,"OpenAI introduces ChatGPT for Excel and new financial app integrations, powered by GPT-5.4 to accelerate modeling, research, and analysis in regulated environments.",ChatGPT Search; GPT ecosystem,76.0,candidate
2026-03-13T05:09:17Z,arXiv cs.CL recent,research,Artificial Intelligence for Sentiment Analysis of Persian Poetry,https://arxiv.org/abs/2603.11254,2026-03-13,"This research measured the capability of modern LLMs (BERT and GPT variants) to analyze and grasp the complexities of classical Persian poetry by Rumi and Parvin E'tesami. It found that these models can effectively process and identify linguistic and thematic patterns within the poetic texts. For content creators targeting AI search, this implies that advanced language models are increasingly capable of understanding nuanced, culturally specific, and stylistically complex content. To optimize for these AI-powered search and analysis surfaces, creators should ensure their content is semantically rich, well-structured, and contextually clear, as models are trained to extract and interpret deep thematic and linguistic features.",LLMs; language retrieval,74.0,candidate
2026-03-12T05:08:47Z,arXiv cs.AI recent,research,Adaptive RAN Slicing Control via Reward-Free Self-Finetuning Agents,https://arxiv.org/abs/2603.10564,2026-03-12,"This paper argues that applying Generative AI to continuous control tasks is hindered by architectural issues like finite context windows and lack of explicit rewards. It proposes a self-finetuning framework where agents learn by internalizing experience into their parameters through direct environmental interaction, rather than relying on prompt-based memory. For content creators targeting AI search, this implies a shift: AI systems are being designed to develop persistent, internal knowledge from ongoing interaction, moving beyond retrieving context from prompts. Content must therefore aim to be foundational training data that shapes these evolving internal models, not just context for a single query.",AI systems; agents; reasoning,74.0,candidate
2026-03-12T05:08:37Z,arXiv cs.AI recent,research,Resource-constrained Amazons chess decision framework integrating large language models and graph attention,https://arxiv.org/abs/2603.10512,2026-03-12,"This research proposes a lightweight hybrid AI framework for the complex Game of the Amazons, designed to operate effectively in resource-constrained environments. It integrates a Graph Attention Autoencoder for structural reasoning with a Large Language Model (LLM) for generative capabilities, guiding a multi-step Monte Carlo Tree Search. The core argument is that this combination enables ""weak-to-strong generalization,"" allowing a system with limited computational resources to achieve strong performance by leveraging structured reasoning and generative planning. For content creators targeting AI search, this implies that future AI systems may increasingly rely on hybrid architectures that combine different reasoning modalities. To be surfaced by these systems, content should be structured to support both explicit, graph-like relational reasoning and the pattern-based, generative inferences of LLMs.",AI systems; agents; reasoning,74.0,candidate
2026-03-12T05:08:05Z,arXiv cs.CL recent,research,A Retrieval-Augmented Language Assistant for Unmanned Aircraft Safety Assessment and Regulatory Compliance,https://arxiv.org/abs/2603.09999,2026-03-12,"This paper designed a retrieval-based AI assistant to support safety assessment and regulatory compliance for drone operations, addressing the growing complexity of certification processes like SORA and PDRA. The system exclusively uses authoritative regulatory sources and is built on a controlled text-based architecture. Its key feature is that it grounds every response in retrieved passages and enforces citations to ensure outputs are traceable and auditable. For content creators targeting AI search, this underscores the critical importance of authoritativeness and clear, retrievable source material; AI systems designed for high-stakes domains will prioritize and explicitly cite well-structured, official content to ensure reliability and compliance.",LLMs; language retrieval,74.0,candidate
2026-03-12T05:07:33Z,arXiv cs.CL recent,research,TAMUSA-Chat: A Domain-Adapted Large Language Model Conversational System for Research and Responsible Deployment,https://arxiv.org/abs/2603.09992,2026-03-12,"This paper introduces TAMUSA-Chat, a framework for adapting general-purpose LLMs to specific institutional domains using supervised fine-tuning and retrieval-augmented generation (RAG). It details a complete architecture for data processing, embedding, training, and deployment, emphasizing modularity for reproducible experimentation. The work demonstrates that successful domain adaptation for conversational AI requires systematic methodologies integrating curated data, tailored training workflows, and robust evaluation. For content creators targeting AI search, this implies that discoverability and utility in specialized domains depend on providing high-quality, structured, and context-rich information that can be reliably retrieved and integrated by such adaptive RAG systems.",LLMs; language retrieval,74.0,candidate
2026-03-11T05:02:47Z,arXiv cs.AI recent,research,AgentOS: From Application Silos to a Natural Language-Driven Data Ecosystem,https://arxiv.org/abs/2603.08938,2026-03-11,"This paper argues that the current architecture for locally hosted AI agents (like OpenClaw) is flawed because they run on legacy operating systems designed for GUIs/CLIs, leading to fragmented interactions, poor permission management (""Shadow AI""), and context loss. It proposes a new paradigm of a unified, agent-centric operating system. For content creators, this implies that as AI agents become primary users, content must be structured for autonomous, programmatic consumption by agents that orchestrate workflows across tools, rather than for direct human readability in traditional search interfaces.",AI systems; agents; reasoning,74.0,candidate
2026-03-11T05:02:39Z,arXiv cs.AI recent,research,Quantifying the Accuracy and Cost Impact of Design Decisions in Budget-Constrained Agentic LLM Search,https://arxiv.org/abs/2603.08877,2026-03-11,"This study measured how search depth, retrieval strategy, and token budgets affect the accuracy and cost of Agentic RAG systems. Using a controlled evaluation harness (BCAS) across six LLMs and three QA benchmarks, it found that accuracy improves with more searches but quickly plateaus, and that a hybrid retrieval approach (combining lexical and dense methods with lightweight re-ranking) yields the best average performance within fixed budgets. For content creators targeting AI search, this implies that optimizing for both keyword matching (lexical) and semantic meaning (dense) is crucial, as these systems use multi-strategy retrieval to find the most relevant information efficiently under strict computational constraints.",AI systems; agents; reasoning,74.0,candidate
2026-03-10T05:05:57Z,arXiv cs.CL recent,research,"Deep Research, Shallow Evaluation: A Case Study in Meta-Evaluation for Long-Form QA Benchmarks",https://arxiv.org/abs/2603.06942,2026-03-10,"This study critiques current meta-evaluation methods for long-form question answering (QA) systems, arguing that standard validation using human pairwise preferences is overly simplistic and fails to capture expert-level nuance. Using the ScholarQA-CS2 benchmark for scientific QA, the research comprehensively validates the benchmark itself. The findings imply that content creators targeting AI search and report generation must prioritize depth, accuracy, and nuanced expert validation over simply optimizing for superficial preferences, as next-generation evaluation frameworks will demand higher-quality, verifiable information.",LLMs; language retrieval,74.0,candidate
2026-03-09T05:18:39Z,arXiv cs.AI recent,research,"Talk Freely, Execute Strictly: Schema-Gated Agentic AI for Flexible and Reproducible Scientific Workflows",https://arxiv.org/abs/2603.06394,2026-03-09,"This study, based on interviews with 18 industrial R&D experts, identifies a core tension in using LLMs for scientific computation: the need for deterministic, governed workflows versus conversational flexibility. It argues any solution must preserve human control and transparency. The proposed resolution is ""schema-gated orchestration,"" where a formal schema acts as a mandatory execution boundary for composed workflows, ensuring no code runs unless it complies with predefined constraints. For content creators targeting AI search, this implies that structured, schema-defined data and clear procedural boundaries will be critical for enabling reliable, trustworthy AI-driven automation in technical and scientific domains.",AI systems; agents; reasoning,74.0,candidate
2026-03-09T05:17:48Z,arXiv cs.AI recent,research,An Interactive Multi-Agent System for Evaluation of New Product Concepts,https://arxiv.org/abs/2603.05980,2026-03-09,"This study proposed using a large language model (LLM)-based multi-agent system (MAS) to automate product concept evaluation, traditionally limited by expert subjectivity and high costs. The system employed eight specialized virtual agents to assess technical and market feasibility. It was found to generate comprehensive, multi-dimensional evaluations by simulating expert team collaboration. For content creators targeting AI search, this implies that content structured to serve specialized, multi-agent AI analysis—providing clear, domain-specific data on dimensions like feasibility—is more likely to be retrieved and synthesized into authoritative answers by such systems, moving beyond simple keyword matching to fulfilling complex analytical roles.",AI systems; agents; reasoning,74.0,candidate
