Discovered At,Feed Name,Feed Category,Title,URL,Published Date,Summary,Platform Relevance,Authority Score,Status
2026-03-07T17:49:40Z,Search Engine Journal,practitioner,"AIO Citations Diverge From Rankings, Bing Rewrites Rules – SEO Pulse via @sejournal, @MattGSouthern",https://www.searchenginejournal.com/seo-pulse-aio-citations-diverge-from-rankings-bing-rewrites-rules/568881/,2026-03-06,"A study measuring AI Overview citations versus traditional search rankings found significant divergence, indicating AI-powered search surfaces prioritize different content signals. This divergence is intensifying as AI search expands and platforms clarify their content display mechanisms. For content creators, this implies that traditional SEO ranking factors are becoming less predictive of inclusion in AI-generated answers. Success now requires optimizing specifically for AI citation logic, which may prioritize direct answers, structured data, and authoritative sources over conventional link-building and keyword strategies.",SEO; GEO; AI search,61.5,candidate
2026-03-09T05:14:19Z,arXiv cs.IR recent,research,HCT-QA: A Benchmark for Question Answering on Human-Centric Tables,https://arxiv.org/abs/2504.20047,2026-03-09,"This research addresses the challenge of querying complex, human-centric tables (HCTs) found in PDFs and web pages, which are information-dense but structurally diverse. It argues that existing methods—either relational transformations or direct use of LLMs/VLMs—are inadequate due to layout complexity or a lack of standardized evaluation. The core finding is the identified absence of a benchmark to measure model performance on natural language queries over HCTs. For content creators, this implies that tabular data with intricate layouts remains poorly accessible to current AI search and query systems, highlighting an opportunity to structure or annotate such content to improve its machine readability and retrieval in AI-powered search environments.",IR; Retrieval; GEO,60.5,candidate
2026-03-09T05:14:11Z,arXiv cs.IR recent,research,Efficient Vector Search in the Wild: One Model for Multi-K Queries,https://arxiv.org/abs/2603.06159,2026-03-09,"OMEGA is a learned top-K search method designed to generalize across different K values for vector queries, addressing the accuracy degradation (for larger Ks) and performance loss (for smaller Ks) seen in models trained for a single K. It achieves high accuracy, performance, and low preprocessing cost by training a base model specifically on K=1 using trajectory-based features. This implies that for content creators targeting AI-powered search, ensuring content is optimized for retrieval systems that efficiently handle variable result set sizes (multi-K queries) is crucial, as generalized models like OMEGA can improve relevance and speed in real-world search applications without prohibitive computational overhead.",IR; Retrieval; GEO,60.5,candidate
2026-03-09T05:13:37Z,arXiv cs.IR recent,research,MLLMRec-R1: Incentivizing Reasoning Capability in Large Language Models for Multimodal Sequential Recommendation,https://arxiv.org/abs/2603.06243,2026-03-09,"Group relative policy optimization (GRPO) is effective for aligning large language models (LLMs) but faces major obstacles when applied to multimodal sequential recommendation (MSR) with multimodal LLMs (MLLMs). The core problems are prohibitive computational costs, as processing visual tokens for historical interactions and multiple candidates makes group-based rollout scaling extremely expensive, and the unsuitability of existing reasoning chains for the multimodal, sequential nature of MSR tasks. This implies that content creators targeting AI search must recognize that optimizing for complex, multimodal AI systems requires fundamentally different and more efficient alignment techniques than those used for text-only models, as current methods do not scale.",IR; Retrieval; GEO,60.5,candidate
2026-03-09T05:13:16Z,arXiv cs.IR recent,research,Balancing Domestic and Global Perspectives: Evaluating Dual-Calibration and LLM-Generated Nudges for Diverse News Recommendation,https://arxiv.org/abs/2603.05780,2026-03-09,"This study tested algorithmic and LLM-based ""nudges"" to expand news readers' consumption of both domestic and world news. It found that algorithmic topic-locality nudges successfully increased exposure and consumption diversity. In contrast, the impact of LLM-based presentation nudges was inconsistent. The research also determined that a user's pre-existing topic interest strongly predicts their clicks, even when content relevance is highlighted. For creators targeting AI search, this implies that while algorithmic surfacing can effectively broaden user exposure, personalized LLM summaries may not reliably alter entrenched consumption patterns; deep user interest remains the primary driver of engagement.",IR; Retrieval; GEO,60.5,candidate
2026-03-09T05:19:10Z,arXiv cs.AI recent,research,From Toil to Thought: Designing for Strategic Exploration and Responsible AI in Systematic Literature Reviews,https://arxiv.org/abs/2603.05514,2026-03-09,"This exploratory design study with 20 researchers identified key friction points in conducting Systematic Literature Reviews (SLRs): the high cognitive load from managing iterative queries across multiple databases, the overwhelming scale of modern literature, and a tension between automation and scholarly agency. These findings imply that content creators targeting AI-powered search must prioritize systems that reduce fragmentation and cognitive overhead. The developed ARC probe demonstrates that future search interfaces will likely favor integrated, multi-database environments, meaning content must be consistently structured and easily retrievable across platforms to be effectively surfaced by AI-driven scholarly tools.",AI systems; agents; reasoning,58.0,candidate
2026-03-09T05:18:52Z,arXiv cs.AI recent,research,Can LLM Aid in Solving Constraints with Inductive Definitions?,https://arxiv.org/abs/2603.03668,2026-03-09,"This research measured the effectiveness of a neuro-symbolic method for solving complex logical constraints involving inductive definitions and abstract data types. It was found that by using structured prompts to guide a Large Language Model (LLM) to generate auxiliary lemmas, and then validating those conjectures with a traditional constraint solver, the system could effectively reason about problems that challenge current state-of-the-art solvers. For content creators targeting AI search, this implies that content structured with clear, logical definitions and explicit, verifiable auxiliary information (akin to lemmas) could improve its utility and retrieval by AI systems performing complex reasoning tasks.",AI systems; agents; reasoning,58.0,candidate
2026-03-09T05:17:35Z,arXiv cs.AI recent,research,The World Won't Stay Still: Programmable Evolution for Agent Benchmarks,https://arxiv.org/abs/2603.05910,2026-03-09,"This paper introduces ProEvolve, a graph-based framework designed to create scalable and controllable evolving environments for testing LLM-powered agents. It argues that current benchmarks use static environments, failing to evaluate agent adaptability to real-world dynamics. ProEvolve uses a typed relational graph to formally represent an environment's data, tools, and schema, enabling programmable evolution. This implies that for AI search, content creators must anticipate and structure information for dynamic, schema-shifting environments, not just static queries, to ensure their tools and data remain discoverable and functional as AI agent ecosystems evolve.",AI systems; agents; reasoning,58.0,candidate
2026-03-09T05:17:30Z,arXiv cs.AI recent,research,Evolving Medical Imaging Agents via Experience-driven Self-skill Discovery,https://arxiv.org/abs/2603.05860,2026-03-09,"This research introduces MACRO, a self-evolving medical AI agent designed to address the brittleness of static tool-use strategies in clinical image interpretation. It argues that predefined tool chains degrade under real-world shifts in tasks and diagnostic needs. MACRO shifts to experience-driven tool discovery, learning to compose and refine its own procedures from past interactions. This implies that for AI search, content must be structured to support dynamic, context-aware tool discovery and composition, moving beyond static, pre-defined information retrieval to enable adaptive reasoning across evolving tasks.",AI systems; agents; reasoning,58.0,candidate
2026-03-09T05:16:56Z,arXiv cs.CL recent,research,Confidence Before Answering: A Paradigm Shift for Efficient LLM Uncertainty Estimation,https://arxiv.org/abs/2603.05881,2026-03-09,"This research introduces CoCA, a reinforcement learning framework that optimizes large language models (LLMs) to output a confidence score *before* generating an answer, interpreting it as the probability of being correct. It argues that this ""confidence-first"" paradigm, which jointly calibrates confidence and answer accuracy via segmented rewards, is more reliable for deployment than traditional ""answer-first"" methods that assess confidence after the fact. For content creators targeting AI search, this implies that future AI-generated answers may be accompanied by pre-computed, well-calibrated confidence metrics. To succeed, creators must produce information that not only answers queries correctly but also enables the AI system to assess its own certainty accurately, prioritizing authoritative, unambiguous, and verifiable content.",LLMs; language retrieval,58.0,candidate
2026-03-09T05:16:48Z,arXiv cs.CL recent,research,ROSE: Reordered SparseGPT for More Accurate One-Shot Large Language Models Pruning,https://arxiv.org/abs/2603.05878,2026-03-09,"This study analyzed the impact of pruning order within the SparseGPT framework for compressing large language models (LLMs). It argued that SparseGPT's fixed left-to-right pruning sequence is suboptimal when model weights exhibit columnar patterns, as it can lead to higher errors. The researchers proposed ROSE, a method that reorders pruning to prioritize weights with larger potential errors earlier in the process, starting with a pre-pruning identification step. The finding implies that optimizing the sequence of pruning—not just the criteria—is crucial for maintaining model performance during compression, a key consideration for developers aiming to deploy efficient, pruned LLMs.",LLMs; language retrieval,58.0,candidate
2026-03-09T05:16:19Z,arXiv cs.CL recent,research,Tutor Move Taxonomy: A Theory-Aligned Framework for Analyzing Instructional Moves in Tutoring,https://arxiv.org/abs/2603.05778,2026-03-09,"This paper presents a taxonomy for analyzing instructional moves in tutoring dialogues, developed through a hybrid deductive-inductive process. The authors synthesized prior research to create a preliminary framework and then refined it via iterative coding. This structured annotation framework is designed to enable the large-scale analysis of one-on-one tutoring sessions within the National Tutoring Observatory. For content creators targeting AI search, this underscores the importance of structuring information into clear, actionable, and systematically classifiable units or ""moves"" to enhance machine parsing and retrieval in educational or instructional contexts.",LLMs; language retrieval,58.0,candidate
2026-03-09T05:16:05Z,arXiv cs.CL recent,research,NERdME: a Named Entity Recognition Dataset for Indexing Research Artifacts in Code Repositories,https://arxiv.org/abs/2603.05750,2026-03-09,"This study introduced NERdME, a dataset of 200 annotated README files with over 10,000 labeled spans across 10 entity types, to address the gap in extracting implementation-level details from code repositories. Baseline experiments with LLMs and fine-tuned transformers demonstrated distinct differences between entities found in scientific papers and those in READMEs. The findings imply that for content targeting AI search in technical domains, creators must optimize for implementation-specific entities (like datasets and source code) available in READMEs, as these require specialized benchmarks and models beyond traditional scholarly information extraction.",LLMs; language retrieval,58.0,candidate
2026-03-09T05:15:25Z,arXiv cs.CL recent,research,"FreeTxt-Vi: A Benchmarked Vietnamese-English Toolkit for Segmentation, Sentiment, and Summarisation",https://arxiv.org/abs/2603.05690,2026-03-09,"This source introduces FreeTxt-Vi, a bilingual (Vietnamese-English) web toolkit for corpus linguistics and NLP analysis. It was designed to enable non-programmers to build, explore, and interpret text collections using features like concordancing, keyword analysis, and visualizations, combined with transformer-based sentiment analysis and summarization. A key technical contribution is its unified NLP pipeline, which integrates a hybrid segmentation strategy using VnCoreNLP and Byte-Pair Encoding (BPE). For content creators targeting AI search, this highlights the growing importance of accessible, multilingual NLP tools that can process and analyze content in diverse languages, emphasizing the need for content that is structurally and linguistically optimized for such hybrid analytical pipelines.",LLMs; language retrieval,58.0,candidate
2026-03-09T05:15:12Z,arXiv cs.CL recent,research,Safer Reasoning Traces: Measuring and Mitigating Chain-of-Thought Leakage in LLMs,https://arxiv.org/abs/2603.05618,2026-03-09,"This research measured direct PII leakage during Chain-of-Thought (CoT) prompting in LLMs, defining it as risk-weighted token events across 11 PII types. It found that CoT consistently increases privacy risk by resurfacing personally identifiable information in reasoning traces and outputs, even when models are instructed not to. Leakage is most pronounced for high-risk PII categories and is strongly dependent on the specific model family and the computational budget allowed for reasoning. For content creators, this implies that content processed by AI search engines using CoT methods may inadvertently expose sensitive user data, necessitating careful consideration of PII within source materials to mitigate unintended disclosure in AI-generated summaries or answers.",LLMs; language retrieval,58.0,candidate
2026-03-09T05:15:04Z,arXiv cs.CL recent,research,NOTAI.AI: Explainable Detection of Machine-Generated Text via Curvature and Feature Attribution,https://arxiv.org/abs/2603.05617,2026-03-09,"Researchers developed NOTAI.AI, a framework for detecting AI-generated text by integrating 17 interpretable features—including curvature, neural scores, and stylometric cues—into an XGBoost classifier. The system was found to outperform Fast-DetectGPT by combining these signals and uses SHAP and an LLM layer to produce natural-language explanations for its decisions. This implies that for content creators, AI search surfaces may increasingly analyze and flag synthetic text based on complex, multi-feature models, making stylistic and probabilistic ""fingerprints"" critical for avoiding detection or for transparency when AI assistance is used.",LLMs; language retrieval,58.0,candidate
2026-03-07T17:52:25Z,Benedict Evans,analyst,The Deep Research problem,https://www.ben-evans.com/benedictevans/2025/2/17/the-deep-research-problem,2025-02-18,"OpenAI's Deep Research tool, designed for complex query analysis, demonstrates significant potential but exhibits critical failures in reliability. The argument is that while the AI can produce impressive initial results, it frequently ""breaks"" under extended use or with nuanced requests, revealing underlying fragility. This implies that content creators targeting AI search must prioritize extreme factual consistency and clear, hierarchical information structure, as these systems, while powerful, are prone to cascading errors when processing ambiguous or poorly organized data.",AI industry; tech strategy,58.0,candidate
2026-03-07T17:34:13Z,Ahrefs Blog,vendor_research,Reddit Keyword Research: 4 Methods to Find Keywords Your Competitors Miss,https://ahrefs.com/blog/reddit-keyword-research/,2026-03-05,"(In fact, search Google for “reddit keyword research” and you’ll notice that 6 of the top 10 results are actual Reddit threads.) That makes Reddit unique and important. It’s a place where your brand’s reputation is shaped by real user<span class=""ellipsis"">&#8230;</span><div class=""read-more"">Read more &#8250;</div><!-- end of .read-more -->",Google AI Overviews; GEO; SEO,58.0,candidate
2026-03-07T17:34:12Z,OpenAI News,official,How Descript enables multilingual video dubbing at scale,https://openai.com/index/descript,2026-03-06,"Descript uses OpenAI models to scale multilingual video dubbing, optimizing translations for both meaning and timing so dubbed speech sounds natural across languages.",ChatGPT Search; GPT ecosystem,58.0,candidate
2026-03-07T17:34:12Z,OpenAI News,official,Introducing GPT-5.4,https://openai.com/index/introducing-gpt-5-4,2026-03-05,"Introducing GPT-5.4, OpenAI’s most most capable and efficient frontier model for professional work, with state-of-the-art coding, computer use, tool search, and 1M-token context.",ChatGPT Search; GPT ecosystem,58.0,candidate
2026-03-07T17:34:12Z,OpenAI News,official,Disrupting malicious uses of AI | February 2026,https://openai.com/index/disrupting-malicious-ai-uses,2026-02-25,Our latest threat report examines how malicious actors combine AI models with websites and social platforms—and what it means for detection and defense.,ChatGPT Search; GPT ecosystem,58.0,candidate
2026-03-09T05:16:27Z,arXiv cs.CL recent,research,RouteGoT: Node-Adaptive Routing for Cost-Efficient Graph of Thoughts Reasoning,https://arxiv.org/abs/2603.05818,2026-03-09,"This paper analyzes multi-step reasoning methods like Tree of Thoughts (ToT) and Graph of Thoughts (GoT) in LLMs, finding that their increased structural complexity does not reliably improve performance over simpler methods like Chain-of-Thought. While these advanced techniques can boost accuracy on specific benchmarks, they often introduce significant overhead in token use and latency, and their performance gains are unstable across different tasks, sometimes underperforming simpler approaches. The authors attribute this inefficiency to heterogeneity within the reasoning pipeline, where critical stages like planning and synthesis are globally coupled and benefit most from powerful models. For content creators targeting AI search, this implies that overly complex, structured content may not yield better visibility or ranking if it introduces inefficiencies that simpler, high-quality reasoning can match or surpass.",LLMs; language retrieval,56.0,candidate
2026-03-07T17:52:48Z,Benedict Evans,analyst,Apple intelligence and AI maximalism,https://www.ben-evans.com/benedictevans/2024/06/20/apple-intelligence,2024-06-20,"The source argues that Apple's generative AI strategy positions large language models (LLMs) as commodity infrastructure rather than proprietary platforms or end-user products. This implies a fundamental shift in the perceived value layer of AI. For content creators targeting AI search, this suggests the competitive focus will move away from simply optimizing for a specific model's outputs. Instead, success will depend on creating unique, high-value content and experiences that sit atop this standardized, ubiquitous infrastructure, as the underlying AI models themselves become less differentiated.",AI industry; tech strategy,56.0,candidate
2026-03-07T17:52:39Z,Benedict Evans,analyst,The AI summer,https://www.ben-evans.com/benedictevans/2024/7/9/the-ai-summer,2024-07-09,"The source argues that despite massive initial adoption, sustained engagement with LLMs like ChatGPT is low, with many users and companies not progressing beyond trials. It posits that while these models appear magical and product-ready, they may be a ""trap,"" lacking inherent product-market fit. This implies that for content creators targeting AI search, simply optimizing for LLM capabilities is insufficient; success requires the slow, fundamental work of building genuinely useful products and services that meet specific, enduring user needs.",AI industry; tech strategy,56.0,candidate
2026-03-07T17:52:35Z,Benedict Evans,analyst,Competing in search,https://www.ben-evans.com/benedictevans/2024/8/19/competing-in-search,2024-08-19,"A U.S. judge ruled Google has abused its monopoly in search, but the practical consequences remain uncertain. The core argument is that Google's dominance stifles competition. This finding implies that the search landscape, long considered settled, may be open to disruption from new entrants like Apple or AI-powered interfaces such as ChatGPT. For content creators, this uncertainty highlights the need to optimize for diverse, emerging search surfaces beyond traditional Google results, as AI-driven answers could fundamentally alter how information is discovered and ranked.",AI industry; tech strategy,56.0,candidate
2026-03-07T17:52:01Z,Benedict Evans,analyst,"AI, networks and Mechanical Turks",https://www.ben-evans.com/benedictevans/2025/11/23/ai-networks-and-mechanical-turks,2025-11-23,"LLMs enable building search and recommendation systems without a vast initial user base by leveraging their pre-trained knowledge to understand queries and content, simulating user interactions for personalization. They can generate synthetic training data and power zero-shot ranking, reducing reliance on extensive historical user data. This implies creators must optimize for LLM comprehension—using clear, factual, and context-rich content—as these systems prioritize semantic understanding over traditional, engagement-heavy signals.",AI industry; tech strategy,56.0,candidate
2026-03-07T17:34:13Z,Ahrefs Blog,vendor_research,"Wikipedia vs Grokipedia: 5x the Pages, 70x the Citations, 1615x the Traffic",https://ahrefs.com/blog/wikipedia-vs-grokipedia/,2026-03-03,"Is Grokipedia a serious competitor to Wikipedia, or just a doomed exercise in billionaire hubris? Does Grok bring new value to the table, or just rehash the same old content? Does Grokipedia influence AI search in a similar way to<span class=""ellipsis"">&#8230;</span><div class=""read-more"">Read more &#8250;</div><!-- end of .read-more -->",Google AI Overviews; GEO; SEO,56.0,candidate
2026-03-07T17:34:13Z,Ahrefs Blog,vendor_research,How to Monitor Brand Mentions in ChatGPT,https://ahrefs.com/blog/monitor-brand-mentions-chatgpt/,2026-02-26,"If you don’t know, that’s a problem. ChatGPT influences millions of product decisions every day—and unlike Google, it gives you zero impressions data, no Search Console, and no built-in analytics. In this guide, I’ll show you how to monitor your<span class=""ellipsis"">&#8230;</span><div class=""read-more"">Read more &#8250;</div><!-- end of .read-more -->",Google AI Overviews; GEO; SEO,56.0,candidate
2026-03-07T17:50:49Z,Search Engine Journal,practitioner,"The Data Reveals: What’s Driving Local Rankings Now via @sejournal, @hethr_campbell",https://www.searchenginejournal.com/what-the-data-shows-about-local-rankings/565920/,2026-03-04,"Analysis of local search ranking factors reveals that traditional signals like citations and backlinks remain important, but reputation signals—specifically Google Business Profile (GBP) engagement metrics (e.g., volume of reviews, photos, and direct user actions like clicks for directions)—are now primary drivers. This data indicates that for content creators and businesses targeting AI-powered local search, optimizing for passive discovery is insufficient. Success requires actively cultivating and managing online reputation to generate high-engagement signals within the GBP ecosystem, as these directly feed the AI models determining local visibility.",SEO; GEO; AI search,55.5,candidate
2026-03-07T17:50:00Z,Search Engine Journal,practitioner,"What SMEC’s Data Reveals About AI Max Performance via @sejournal, @brookeosmundson",https://www.searchenginejournal.com/what-smecs-data-reveals-about-ai-max-performance/568866/,2026-03-05,"A study by SMEC measured the performance of Google Ads' AI Max bidding in search campaigns. It found a 13% increase in conversion value, but this was accompanied by a higher cost per acquisition (CPA) and inconsistent return on ad spend (ROAS). For content creators and advertisers targeting AI-powered search surfaces, this implies that while AI-driven tools can boost overall conversion metrics, they may also introduce greater cost volatility and less predictable efficiency, requiring careful budget management and performance monitoring.",SEO; GEO; AI search,55.5,candidate
2026-03-07T17:49:55Z,Search Engine Journal,practitioner,"NanoClaw Creator Loses SEO Battle To Impostor Website via @sejournal, @MattGSouthern",https://www.searchenginejournal.com/nanoclaw-creator-loses-seo-battle-to-impostor-website/568885/,2026-03-05,"A developer argued that Google's AI-powered search (SGE) incorrectly ranked a fake website above his legitimate project's site, despite the real site having significant credibility signals like 18,000 GitHub stars, press coverage, and proper structured data. This case found that traditional SEO authority metrics and on-page optimization were insufficient to guarantee accurate ranking in this generative search environment. It implies that content creators must actively monitor for brand impersonations and that current search algorithms may still be vulnerable to manipulation or misalignment on AI surfaces, prioritizing unclear signals over established webmaster-provided credentials.",SEO; GEO; AI search,55.5,candidate
